repo,issue_link,issue_id,post,question,answer
zeromq/libzmq,https://github.com/zeromq/libzmq/issues/3517,zeromq_libzmq_issues_3517,"configure errors because of syntax errors in the use of test shell command

*Please use this template for reporting suspected bugs or requests for help.* # Issue description On my system, where /bin/sh -> /bin/dash, runnung ./configure produces errors which I tracked down to configure.ac and acinclude.m4 using the test shell command with a == operator, syntax which is not valid in a POSIX-like shell like dash. See [man 1p test](https://www.unix.com/man-page/posix/1P/TEST/) for details. # Environment * libzmq version (commit hash if unreleased): cef80655 * OS: Void Linux x86_64 # Minimal test code / Steps to reproduce the issue 1. Run ./autogen.sh 2. Run ./configure # What's the actual result? (include assertion message & call stack if applicable)  Full output of running the repro steps on my system: step 1: [output](https://gist.github.com/f7762a406c62228a0012c55d49c6f754) step 2: [output](https://gist.github.com/65dea53e4a9a48c1131af6d0de7b2069). # What's the expected result? Running configure should produce no such errors.",Could you please send a PR to fix it?,See [man 1p test](https://www.unix.com/man-page/posix/1P/TEST/) for details.
ranger/ranger,https://github.com/ranger/ranger/issues/1214,ranger_ranger_issues_1214,"Having issues installing Ranger with anaconda python3.6

#### Runtime Environment <!-- Retrieve Python/ranger version and locale with ranger --version --> - Operating system and version: macOS High Sierra, Version 10.13.5 - Terminal emulator and version: Terminal, Version 2.8.2 (404) - Python version: Python 3.6.4, Anaconda custom (64-bit) - Ranger version/commit: 1.9.1 - Locale: I have no idea about this #### Current Behavior Whenever I try to do 'make install' in the ranger folder, I get the following error: https://imgur.com/a/g2XkVNp #### Expected Behavior I expect to install ranger using this. However running ranger with 'python2.7 ranger.py' I can succesfully run ranger. My version of python2.7 is 2.7.10 (not installed using anaconda). This in turn does not work using python3.6 nor python3 (they give the same error as shown in the screenshot). #### Traceback <!-- If ranger crashes, paste the traceback in the quotes below. -->  Best regards Jacob SOLUTION: In Terminal Preferences -> Profiles -> Advanced -> Uncheck ""Set locale environment variables on startup""",What's the output for locale on the command line?,"SOLUTION: In Terminal Preferences -> Profiles -> Advanced -> Uncheck ""Set locale environment variables on startup"""
ranger/ranger,https://github.com/ranger/ranger/issues/1890,ranger_ranger_issues_1890,"Multiple issues with kitty image preview.

#### Runtime Environment - Operating system and version: Archlinux - Terminal emulator and version: kitty 0.16 - ranger version: ranger 1.9.3 - Python version: 3.8.2 (default, Feb 26 2020, 22:21:03) [GCC 9.2.1 20200130] - Locale: en_US.UTF-8 #### Steps to reproduce 1. navigate to an image 1. open_width [dragon-drag-and-drop](https://github.com/schne324/dragon-drop) / or virtually any program. 1. ctrl+c to close dragon-drop / close the program in any way",Does this happen if you close dragon-drop a different way?,/or virtually any program.
ranger/ranger,https://github.com/ranger/ranger/issues/1437,ranger_ranger_issues_1437,"Expanded images disappear

<!-- Thank you for contributing to ranger by opening this issue. Please check through this list, so you can be as helpful as possible: 1. Was this issue already reported? Please do a quick search. 2. Maybe the problem is solved in the current master branch already? Simply clone ranger's git repository and run ./ranger.py to find out. 3. Provide all the relevant information, as outlined in this template. Feel free to remove any sections you don't need. --> #### Runtime Environment <!-- Retrieve Python/ranger version and locale with ranger --version --> - Operating system and version: Arch - Terminal emulator and version: urxvt 9.22 - Python version: 3.7.2 - Ranger version/commit: 1.9.2 - Locale: US #### Current Behavior Pressing i on an image will not show it expanded. It appears like an empty ranger. Edit: this is with the w3m method. #### Expected Behavior To view the image expanded #### Context <!-- How has this issue affected you? What are you trying to accomplish? --> I believe there was an issue about this posted here but I couldn't find it so apologies if it's true. I've tried urxvt/urxvt-full with pixbuf support which both showed the image on expansion but it looked choppy, and rendered over the text unlike below image which is perfectly aligned and centered. ![1547060685001](https://user-images.githubusercontent.com/40843060/50974541-2e8eb600-1537-11e9-8677-9d7a0e8115c9.png) ^ is a nice desktop of what I'm trying to achieve w3m simply won't work even though I asked the owner of this desktop what method he used and he replied w3m IIRC. Cheers.","Do you have w3mimgdisplay installed, should be in the w3m package on arch?",. Edit: this is with the w3m method
apache/trafficserver,https://github.com/apache/trafficserver/issues/4440,apache_trafficserver_issues_4440,"ats7.1.4 get method sometime has no response

**request** ![image](https://user-images.githubusercontent.com/17612824/47210146-c069a580-d3c4-11e8-838f-7efa64c133be.png) **ats do not responds in 500ms** ![image](https://user-images.githubusercontent.com/17612824/47275672-ec16a680-d5e3-11e8-8aa2-15b74f010cb0.png) **some key debug log (in another request** ![image](https://user-images.githubusercontent.com/17612824/47276719-bd9cc980-d5eb-11e8-9043-65424225e65f.png) **detail debug log** [Oct 19 14:22:19.944] Server {0x2ad0325cc700} DEBUG: <HttpTransact.cc:2431 (HandleCacheOpenReadHitFreshness)> (http_trans) [26480] [HandleCacheOpenReadHitFreshness] response_received_time : 1539921470 [Oct 19 14:22:19.944] Server {0x2ad0325cc700} DEBUG: <HttpTransact.cc:7296 (calculate_document_freshness_limit)> (http_match) [26480] calculate_document_freshness_limit --- max_age set, freshness_limit = 157680000 [Oct 19 14:22:19.944] Server {0x2ad0325cc700} DEBUG: <HttpTransact.cc:7387 (calculate_document_freshness_limit)> (http_match) [26480] calculate_document_freshness_limit --- final freshness_limit = 31536000 [Oct 19 14:22:19.944] Server {0x2ad0325cc700} DEBUG: <HttpTransact.cc:7517 (what_is_document_freshness)> (http_match) [26480] [what_is_document_freshness] fresh_limit: 31536000 current_age: 8669 [Oct 19 14:22:19.944] Server {0x2ad0325cc700} DEBUG: <HttpTransact.cc:7564 (what_is_document_freshness)> (http_match) [26480] [..._document_freshness] initial age limit: 31536000 [Oct 19 14:22:19.944] Server {0x2ad0325cc700} DEBUG: <HttpTransact.cc:7620 (what_is_document_freshness)> (http_match) [26480] document_freshness --- current_age = 8669 [Oct 19 14:22:19.944] Server {0x2ad0325cc700} DEBUG: <HttpTransact.cc:7621 (what_is_document_freshness)> (http_match) [26480] document_freshness --- age_limit = 31536000 [Oct 19 14:22:19.944] Server {0x2ad0325cc700} DEBUG: <HttpTransact.cc:7622 (what_is_document_freshness)> (http_match) [26480] document_freshness --- fresh_limit = 31536000 [Oct 19 14:22:19.944] Server {0x2ad0325cc700} DEBUG: <HttpTransact.cc:7623 (what_is_document_freshness)> (http_seq) [26480] document_freshness --- current_age = 8669 [Oct 19 14:22:19.944] Server {0x2ad0325cc700} DEBUG: <HttpTransact.cc:7624 (what_is_document_freshness)> (http_seq) [26480] document_freshness --- age_limit = 31536000 [Oct 19 14:22:19.945] Server {0x2ad0325cc700} DEBUG: <HttpTransact.cc:7625 (what_is_document_freshness)> (http_seq) [26480] document_freshness --- fresh_limit = 31536000 [Oct 19 14:22:19.945] Server {0x2ad0325cc700} DEBUG: <HttpTransact.cc:7644 (what_is_document_freshness)> (http_match) [26480] [..._document_freshness] document is fresh; returning FRESHNESS_FRESH [Oct 19 14:22:19.945] Server {0x2ad0325cc700} DEBUG: <HttpTransact.cc:2441 (HandleCacheOpenReadHitFreshness)> (http_seq) [26480] [HttpTransact::HandleCacheOpenReadHitFreshness] Fresh copy [Oct 19 14:22:19.945] Server {0x2ad0325cc700} DEBUG: <HttpTransact.cc:2522 (need_to_revalidate)> (http_seq) [26480] [HttpTransact::HandleCacheOpenReadHit] Authentication not needed [Oct 19 14:22:19.945] Server {0x2ad0325cc700} DEBUG: <HttpSM.cc:7204 (call_transact_and_set_next_state)> (http) [26480] State Transition: SM_ACTION_API_READ_CACHE_HDR -> SM_ACTION_API_CACHE_LOOKUP_COMPLETE [Oct 19 14:22:19.945] Server {0x2ad0325cc700} DEBUG: <HttpSM.cc:1417 (state_api_callout)> (http) [26480] calling plugin on hook TS_HTTP_CACHE_LOOKUP_COMPLETE_HOOK at hook 0x2ad034028fe0 [Oct 19 14:22:19.945] Server {0x2ad0325cc700} DEBUG: <HttpSM.cc:1296 (state_api_callback)> (http) [26480] [&HttpSM::state_api_callback, HTTP_API_CONTINUE] [Oct 19 14:22:19.945] Server {0x2ad0325cc700} DEBUG: <HttpSM.cc:1336 (state_api_callout)> (http) [26480] [&HttpSM::state_api_callout, HTTP_API_CONTINUE] [Oct 19 14:22:19.945] Server {0x2ad0325cc700} DEBUG: <HttpTransact.cc:2620 (HandleCacheOpenReadHit)> (http_seq) [26480] [HttpTransact::HandleCacheOpenReadHit] Authentication not needed [Oct 19 14:22:19.945] Server {0x2ad0325cc700} DEBUG: <HttpTransact.cc:2690 (HandleCacheOpenReadHit)> (http_trans) [26480] CacheOpenRead --- needs_auth = 0 [Oct 19 14:22:19.945] Server {0x2ad0325cc700} DEBUG: <HttpTransact.cc:2691 (HandleCacheOpenReadHit)> (http_trans) [26480] CacheOpenRead --- needs_revalidate = 0 [Oct 19 14:22:19.945] Server {0x2ad0325cc700} DEBUG: <HttpTransact.cc:2692 (HandleCacheOpenReadHit)> (http_trans) [26480] CacheOpenRead --- response_returnable = 1 [Oct 19 14:22:19.945] Server {0x2ad0325cc700} DEBUG: <HttpTransact.cc:2693 (HandleCacheOpenReadHit)> (http_trans) [26480] CacheOpenRead --- needs_cache_auth = 0 [Oct 19 14:22:19.945] Server {0x2ad0325cc700} DEBUG: <HttpTransact.cc:2694 (HandleCacheOpenReadHit)> (http_trans) [26480] CacheOpenRead --- send_revalidate = 0 [Oct 19 14:22:19.945] Server {0x2ad0325cc700} DEBUG: <HttpTransact.cc:2826 (HandleCacheOpenReadHit)> (http_trans) [26480] CacheOpenRead --- HIT-FRESH [Oct 19 14:22:19.945] Server {0x2ad0325cc700} DEBUG: <HttpTransact.cc:2828 (HandleCacheOpenReadHit)> (http_seq) [26480] [HttpTransact::HandleCacheOpenReadHit] Serve from cache [Oct 19 14:22:19.945] Server {0x2ad0325cc700} DEBUG: <HttpTransact.cc:2925 (build_response_from_cache)> (http_trans) [26480] [build_response_from_cache] Match! Serving full document. [Oct 19 14:22:19.945] Server {0x2ad0325cc700} DEBUG: <HttpTransact.cc:6873 (handle_content_length_header)> (http_trans) [26480] [handle_content_length_header] RESPONSE cont len in hdr is 2097152 -- State Machine Id: 26480 -- State Machine Id: 26480 [Oct 19 14:22:19.945] Server {0x2ad0325cc700} DEBUG: <HttpSM.cc:7204 (call_transact_and_set_next_state)> (http) [26480] State Transition: SM_ACTION_API_CACHE_LOOKUP_COMPLETE -> SM_ACTION_SERVE_FROM_CACHE [Oct 19 14:22:19.945] Server {0x2ad0325cc700} DEBUG: <HttpSM.cc:5775 (perform_cache_write_action)> (http) [26480] perform_cache_write_action CACHE_DO_SERVE [Oct 19 14:22:19.945] Server {0x2ad0325cc700} DEBUG: <HttpTunnel.cc:683 (add_producer)> (http_tunnel) [26480] adding producer 'cache read' [Oct 19 14:22:19.945] Server {0x2ad0325cc700} DEBUG: <HttpTunnel.cc:738 (add_consumer)> (http_tunnel) [26480] adding consumer 'user agent' [Oct 19 14:22:19.945] Server {0x2ad0325cc700} DEBUG: <HttpTunnel.cc:1162 (producer_handler)> (http_tunnel) [26480] producer_handler [cache read VC_EVENT_READ_COMPLETE] [Oct 19 14:22:19.945] Server {0x2ad0325cc700} DEBUG: <HttpSM.cc:3352 (tunnel_handler_cache_read)> (http) [26480] [&HttpSM::tunnel_handler_cache_read, VC_EVENT_READ_COMPLETE] [Oct 19 14:22:19.946] Server {0x2ad0325cc700} DEBUG: <HttpTunnel.cc:1359 (consumer_handler)> (http_tunnel) [26480] consumer_handler [user agent VC_EVENT_WRITE_READY] [Oct 19 14:22:19.946] Server {0x2ad0325cc700} DEBUG: <HttpTunnel.cc:1359 (consumer_handler)> (http_tunnel) [26480] consumer_handler [user agent VC_EVENT_ERROR] [Oct 19 14:22:19.946] Server {0x2ad0325cc700} DEBUG: <HttpSM.cc:3183 (tunnel_handler_ua)> (http) [26480] [&HttpSM::tunnel_handler_ua, VC_EVENT_ERROR] [Oct 19 14:22:19.946] Server {0x2ad0325cc700} DEBUG: <HttpSM.cc:2607 (main_handler)> (http) [26480] [HttpSM::main_handler, HTTP_TUNNEL_EVENT_DONE] [Oct 19 14:22:19.946] Server {0x2ad0325cc700} DEBUG: <HttpSM.cc:2879 (tunnel_handler)> (http) [26480] [&HttpSM::tunnel_handler, HTTP_TUNNEL_EVENT_DONE] [Oct 19 14:22:19.946] Server {0x2ad0325cc700} DEBUG: <HttpSM.cc:6947 (kill_this)> (http) [26480] deallocating sm **source code** void write_to_net_io(NetHandler *nh, UnixNetVConnection *vc, EThread *thread) { NetState *s = &vc->write; ProxyMutex *mutex = thread->mutex.get(); MUTEX_TRY_LOCK_FOR(lock, s->vio.mutex, thread, s->vio._cont); if (!lock.is_locked() || lock.get_mutex() != s->vio.mutex.get()) { write_reschedule(nh, vc); return; } // This function will always return true unless // vc is an SSLNetVConnection. if (!vc->getSSLHandShakeComplete()) { int err, ret; if (vc->get_context() == NET_VCONNECTION_OUT) { ret = vc->sslStartHandShake(SSL_EVENT_CLIENT, err); } else { ret = vc->sslStartHandShake(SSL_EVENT_SERVER, err); } if (ret == EVENT_ERROR) { vc->write.triggered = 0; write_signal_error(nh, vc, err); } else if (ret == SSL_HANDSHAKE_WANT_READ || ret == SSL_HANDSHAKE_WANT_ACCEPT) { vc->read.triggered = 0; nh->read_ready_list.remove(vc); read_reschedule(nh, vc); } else if (ret == SSL_HANDSHAKE_WANT_CONNECT || ret == SSL_HANDSHAKE_WANT_WRITE) { vc->write.triggered = 0; nh->write_ready_list.remove(vc); write_reschedule(nh, vc); } else if (ret == EVENT_DONE) { vc->write.triggered = 1; if (vc->write.enabled) { nh->write_ready_list.in_or_enqueue(vc); } } else { write_reschedule(nh, vc); } return; } // If it is not enabled,add to WaitList. if (!s->enabled || s->vio.op != VIO::WRITE) { write_disable(nh, vc); return; } // If there is nothing to do, disable int64_t ntodo = s->vio.ntodo(); if (ntodo <= 0) { write_disable(nh, vc); return; } MIOBufferAccessor &buf = s->vio.buffer; ink_assert(buf.writer()); // Calculate the amount to write. int64_t towrite = buf.reader()->read_avail(); if (towrite > ntodo) { towrite = ntodo; } int signalled = 0; // signal write ready to allow user to fill the buffer if (towrite != ntodo && buf.writer()->write_avail()) { if (write_signal_and_update(VC_EVENT_WRITE_READY, vc) != EVENT_CONT) { return; } ntodo = s->vio.ntodo(); if (ntodo <= 0) { write_disable(nh, vc); return; } signalled = 1; // Recalculate amount to write towrite = buf.reader()->read_avail(); if (towrite > ntodo) { towrite = ntodo; } } // if there is nothing to do, disable ink_assert(towrite >= 0); if (towrite <= 0) { write_disable(nh, vc); return; } int needs = 0; int64_t total_written = 0; int64_t r = vc->load_buffer_and_write(towrite, buf, total_written, needs); if (total_written > 0) { NET_SUM_DYN_STAT(net_write_bytes_stat, total_written); s->vio.ndone += total_written; net_activity(vc, thread); } // A write of 0 makes no sense since we tried to write more than 0. ink_assert(r != 0); // Either we wrote something or got an error. // check for errors if (r < 0) { // if the socket was not ready, add to WaitList if (r == -EAGAIN || r == -ENOTCONN || -r == EINPROGRESS) { NET_INCREMENT_DYN_STAT(net_calls_to_write_nodata_stat); if ((needs & EVENTIO_WRITE) == EVENTIO_WRITE) { vc->write.triggered = 0; nh->write_ready_list.remove(vc); write_reschedule(nh, vc); } if ((needs & EVENTIO_READ) == EVENTIO_READ) { vc->read.triggered = 0; nh->read_ready_list.remove(vc); read_reschedule(nh, vc); } return; } vc->write.triggered = 0; write_signal_error(nh, vc, (int)-total_written); return; } else { // Wrote data. Finished without error int wbe_event = vc->write_buffer_empty_event; // save so we can clear if needed. // If the empty write buffer trap is set, clear it. if (!(buf.reader()->is_read_avail_more_than(0))) { vc->write_buffer_empty_event = 0; } // If there are no more bytes to write, signal write complete, ink_assert(ntodo >= 0); if (s->vio.ntodo() <= 0) { write_signal_done(VC_EVENT_WRITE_COMPLETE, nh, vc); return; } int e = 0; if (!signalled) { e = VC_EVENT_WRITE_READY; } else if (wbe_event != vc->write_buffer_empty_event) { // @a signalled means we won't send an event, and the event values differing means we // had a write buffer trap and cleared it, so we need to send it now. e = wbe_event; } if (e) { if (write_signal_and_update(e, vc) != EVENT_CONT) { return; } // change of lock... don't look at shared variables! if (lock.get_mutex() != s->vio.mutex.get()) { write_reschedule(nh, vc); return; } } if ((needs & EVENTIO_READ) == EVENTIO_READ) { read_reschedule(nh, vc); } if (!(buf.reader()->is_read_avail_more_than(0))) { write_disable(nh, vc); return; } if ((needs & EVENTIO_WRITE) == EVENTIO_WRITE) { write_reschedule(nh, vc); } return; } } **in this function load_buffer_and_write return -32 EPIPE error** int64_t r = vc->load_buffer_and_write(towrite, buf, total_written, needs);",What does get method error mean ? Can you share more information?,"**debug log** **in write_to_net_io function** void write_to_net_io(NetHandler *nh, UnixNetVConnection *vc, EThread *thread) { NetState *s = &vc->write; ProxyMutex *mutex = thread->mutex.get(); MUTEX_TRY_LOCK_FOR(lock, s->vio.mutex, thread, s->vio._cont); if (!lock.is_locked() || lock.get_mutex() != s->vio.mutex.get()) { write_reschedule(nh, vc); return; } // This function will always return true unless // vc is an SSLNetVConnection. if (!vc->getSSLHandShakeComplete()) { int err, ret; if (vc->get_context() == NET_VCONNECTION_OUT) { ret = vc->sslStartHandShake(SSL_EVENT_CLIENT, err); } else { ret = vc->sslStartHandShake(SSL_EVENT_SERVER, err); } if (ret == EVENT_ERROR) { vc->write.triggered = 0; write_signal_error(nh, vc, err); } else if (ret == SSL_HANDSHAKE_WANT_READ || ret == SSL_HANDSHAKE_WANT_ACCEPT) { vc->read.triggered = 0; nh->read_ready_list.remove(vc); read_reschedule(nh, vc); } else if (ret == SSL_HANDSHAKE_WANT_CONNECT || ret == SSL_HANDSHAKE_WANT_WRITE) { vc->write.triggered = 0; nh->write_ready_list.remove(vc); write_reschedule(nh, vc); } else if (ret == EVENT_DONE) { vc->write.triggered = 1; if (vc->write.enabled) { nh->write_ready_list.in_or_enqueue(vc); } } else { write_reschedule(nh, vc); } return; } // If it is not enabled,add to WaitList. if (!s->enabled || s->vio.op != VIO::WRITE) { write_disable(nh, vc); return; } // If there is nothing to do, disable int64_t ntodo = s->vio.ntodo(); if (ntodo <= 0) { write_disable(nh, vc); return; } MIOBufferAccessor &buf = s->vio.buffer; ink_assert(buf.writer()); // Calculate the amount to write. int64_t towrite = buf.reader()->read_avail(); if (towrite > ntodo) { towrite = ntodo; } int signalled = 0; // signal write ready to allow user to fill the buffer if (towrite != ntodo && buf.writer()->write_avail()) { if (write_signal_and_update(VC_EVENT_WRITE_READY, vc) != EVENT_CONT) { return; } ntodo = s->vio.ntodo(); if (ntodo <= 0) { write_disable(nh, vc); return; } signalled = 1; // Recalculate amount to write towrite = buf.reader()->read_avail(); if (towrite > ntodo) { towrite = ntodo; } } // if there is nothing to do, disable ink_assert(towrite >= 0); if (towrite <= 0) { write_disable(nh, vc); return; } int needs = 0; int64_t total_written = 0; int64_t r = vc->load_buffer_and_write(towrite, buf, total_written, needs); if (total_written > 0) { NET_SUM_DYN_STAT(net_write_bytes_stat, total_written); s->vio.ndone += total_written; net_activity(vc, thread); } // A write of 0 makes no sense since we tried to write more than 0. ink_assert(r != 0); // Either we wrote something or got an error. // check for errors if (r < 0) { // if the socket was not ready, add to WaitList if (r == -EAGAIN || r == -ENOTCONN || -r == EINPROGRESS) { NET_INCREMENT_DYN_STAT(net_calls_to_write_nodata_stat); if ((needs & EVENTIO_WRITE) == EVENTIO_WRITE) { vc->write.triggered = 0; nh->write_ready_list.remove(vc); write_reschedule(nh, vc); } if ((needs & EVENTIO_READ) == EVENTIO_READ) { vc->read.triggered = 0; nh->read_ready_list.remove(vc); read_reschedule(nh, vc); } return; } vc->write.triggered = 0; write_signal_error(nh, vc, (int)-total_written); return; } else { // Wrote data. Finished without error int wbe_event = vc->write_buffer_empty_event; // save so we can clear if needed. // If the empty write buffer trap is set, clear it. if (!(buf.reader()->is_read_avail_more_than(0))) { vc->write_buffer_empty_event = 0; } // If there are no more bytes to write, signal write complete, ink_assert(ntodo >= 0); if (s->vio.ntodo() <= 0) { write_signal_done(VC_EVENT_WRITE_COMPLETE, nh, vc); return; } int e = 0; if (!signalled) { e = VC_EVENT_WRITE_READY; } else if (wbe_event != vc->write_buffer_empty_event) { // @a signalled means we won't send an event, and the event values differing means we // had a write buffer trap and cleared it, so we need to send it now. e = wbe_event; } if (e) { if (write_signal_and_update(e, vc) != EVENT_CONT) { return; } // change of lock... don't look at shared variables! if (lock.get_mutex() != s->vio.mutex.get()) { write_reschedule(nh, vc); return; } } if ((needs & EVENTIO_READ) == EVENTIO_READ) { read_reschedule(nh, vc); } if (!(buf.reader()->is_read_avail_more_than(0))) { write_disable(nh, vc); return; } if ((needs & EVENTIO_WRITE) == EVENTIO_WRITE) { write_reschedule(nh, vc); } return; } } **in this function load_buffer_and_write return -32 EPIPE error** int64_t r = vc->load_buffer_and_write(towrite, buf, total_written, needs); **request****ats do not responds in 500ms** ![image](https://user-images.githubusercontent.com/17612824/47275672-ec16a680-d5e3-11e8-8aa2-15b74f010cb0.png)"
tpope/vim-fugitive,https://github.com/tpope/vim-fugitive/issues/1446,tpope_vim-fugitive_issues_1446,"Wall-of-text issue with refreshing git hooks

Hey :wave:, I'm using https://github.com/typicode/husky for some of my projects and when triggering a hook fugitive outputs *a lot* of text. I have to press <Space> to go down a full screen more than a couple of times. The text is also blank until I scroll up and down a bit. The following is an example of the output generated:  The above text is repeated atleast a 50-100 times (except the first one of course). Is is possible for fugitive to handle these cases where the git hook is refreshing the output? Or is it possible to fugitive to skip the output?",Can you try with let g:fugitive_pty = 0?,Or is it possible to fugitive to skip the output?
slick/slick,https://github.com/slick/slick/issues/2099,slick_slick_issues_2099,"createIfNotExists doesn't create auto increment sequences

**DESCRIPTION:** Using createIfNotExists does not create auto increment sequences, whereas create works just fine in creating those sequences. A symptom of this issue is if you use createIfNotExists with O.AutoInc fields, you will get these errors:  This doesn't happen if you have the correct sequence. **STEPS TO REPRODUCE:** Clone [mdibaiee/slick-bug-sequences](https://github.com/mdibaiee/slick-bug-sequences) and run the code as is initially:  **EXPECTED RESULT:** Sequence should be created and no error should be thrown. **ACTUAL RESULT:** You will get an error:  Also try connecting to the database (psql slick_bug) and check for sequences and tables:  You will see tables existing, but no sequences. Now try changing the src/main/scala/example/Hello.scala file and replacing createIfNotExists with create. Drop the database and recreate and run again:  This time there will be no errors and you can check that the sequence is created successfully in postgres shell (psql slick_bug):  **SETUP:** Libraries:  Postgres 12.1",Can you please check? @gnufied @jkutner @marcospereira,"UAL RESULT:** You will get an error:  Also try connecting to the database (psql slick_bug) and check for sequences and tables:  You will see tables existing, but no sequences. Now t"
