repo,issue_link,issue_id,post,question,answer
GoldenCheetah/GoldenCheetah,https://github.com/GoldenCheetah/GoldenCheetah/issues/2891,GoldenCheetah_GoldenCheetah_issues_2891,"HRV Measurements from iOS

Hi, im getting format error from a CSV imported from an iOS phone. Its file from HRV4training. Downloading of HRV measurements failed with error: invalid 'timestamp' - Date/Time not ISO 8601 format - in line 2 7:33:00 Using Version 3.5-DEV1806 If i could help anything, let me know rault_ruiz@hotmail.com This is the file from the athlete i have issues. If you cant recreate, then is my computer. Thanks anyway! [2018_7_8_myMeasurements.zip](https://github.com/GoldenCheetah/GoldenCheetah/files/2193535/2018_7_8_myMeasurements.zip)",Can you attach the file for debugging?,"This is the file from the athlete i have issues. If you cant recreate, then is my computer. Thanks anyway! [2018_7_8_myMeasurements.zip](https://github.com/GoldenCheetah/GoldenCheetah/files/2193535/2018_7_8_myMeasurements.zip)"
rzwitserloot/lombok,https://github.com/rzwitserloot/lombok/issues/1907,rzwitserloot_lombok_issues_1907,"@Builder annotation causes compile error with Java 11

Hello! My code using the @Builder annotation does not compile with Java 11 (or Java 10) while it compiles properly with Java 8. As issue #1896 was closed and I could not reopen it, I create this issue to provide the code; please see here: https://github.com/jrmyr/lombokbuilder. To reproduce the problem, just clone the repo and execute a simple gradle compileJava in it. Depending on the Java version in use, it will pass (8) or fail (10, 11). Tested on Mac. Please tell me if you need more info. Thanks.",Can you try to assign the result of the build method to a local variable first?,gradle and gradle and
jquery/jquery,https://github.com/jquery/jquery/issues/4527,jquery_jquery_issues_4527,"Textbox focus select is not working in 3.4.1

<!-- Feature Requests: Please read https://github.com/jquery/jquery/wiki/Adding-new-features Most features should start as plugins outside of jQuery. Bug Reports: Note that we only can fix bugs in the latest version of jQuery. Briefly describe the issue you've encountered * What do you expect to happen? * What actually happens? * Which browsers are affected? Provide a *minimal* test case, see https://webkit.org/test-case-reduction/ Use the latest shipping version of jQuery in your test case! We prefer test cases on JS Bin (https://jsbin.com/qawicop/edit?html,css,js,output) or CodePen (https://codepen.io/mgol/pen/wNWJbZ) Frequently Reported Issues: * Selectors with '#' break: See https://github.com/jquery/jquery/issues/2824 --> ### Description ### As you can see below, this code is to select entire textbox value on focus but it doesn't work in 3.4.1 which was working in 3.3.1. $('#textbox).focus(function () { $(this).one('mouseup', function (event) { event.preventDefault(); }).select(); }); ### Link to test case ###","Can you provide a test case on [JS Bin](https://jsbin.com/qawicop/edit?html,css,js,output) as the issue template requested? Thanks!","As you can see below, this code is to select entire textbox value on focus but it doesn't work in 3.4.1 which was working in 3.3.1. $('#textbox).focus(function () { $(this).one('mouseup', function (event) { event.preventDefault(); }).select(); });"
SDWebImage/SDWebImage,https://github.com/SDWebImage/SDWebImage/issues/2471,SDWebImage_SDWebImage_issues_2471,"images didn't cached

### New Issue Checklist * [X] I have read and understood the [CONTRIBUTING guide](https://github.com/rs/SDWebImage/blob/master/.github/CONTRIBUTING.md) * [X] I have read the [Documentation](http://cocoadocs.org/docsets/SDWebImage/) * [X] I have searched for a similar issue in the [project](https://github.com/rs/SDWebImage/issues) and found none ### Issue Info Info | Value | -------------------------|-------------------------------------| Platform Name | ios Platform Version | 11.4 SDWebImage Version | 4.2.2 Integration Method | cocoapods Xcode Version | Xcode 9 Repro rate | e.g. all the time (100%) / sometimes x% / only once Repro with our demo prj | e.g. does it happen with our demo project? Demo project link | e.g. link to a demo project that highlights the issue Dears, I have a problem when cache image in table view or collection view the problem is when load first cells the images has been loaded then move scroll down then back to up the images already loaded it's clear and download again, there issue i'm not sure if related a problem, when move to down some images return error from cache ""canceled"" to more details please see the [video](https://drive.google.com/open?id=1N4HHyGJRGOWUc2Bc5Cy97ZbzVvfjkA7l) Many Thanks Regards",Did you load the image with FLAnimatedImageView in 4.x ? It's also recommend to provide a code snippet of your usage or a demo project to reproduce this issue.,"### New Issue Checklist * [ Yes] I have read and understood the [CONTRIBUTING guide](https://github.com/rs/SWebImage/blob/master/.github/CONTRIBUTING.md) * [ Yes] I have read the [Documentation](http://cocoadocs.org/docsets/SDWebImage/) * [Yes ] I have searched for a similar issue in the [project](https://github.com/rs/SDWebImage/issues) and found none ### Issue Info Info | Value | -------------------------|-------------------------------------| Platform Name | ios Platform Version | 11.4 SDWebImage Version | 4.2.2 Integration Method | cocoapods Xcode Version | Xcode 9 Repro rate | e.g. all the time (100%) / sometimes x% / only once Repro with our demo prj | e.g. does it happen with our demo project? Demo project link | e.g. link to a demo project that highlights the issue D my code : self.productImage.sd_setImage(with: url1, placeholderImage:Helper.sharedInstance.getPlaceholderImg())"
pymc-devs/pymc3,https://github.com/pymc-devs/pymc3/issues/3330,pymc-devs_pymc3_issues_3330,"TypeError: zip argument #1 must support iteration

## Description of your problem **Please provide a minimal, self-contained, and reproducible example.**  **Please provide the full traceback.**  **Please provide any additional information below.** I wanted to sample sums over columns of counts, but sum() didn't work for me and then even simple creation of Deterministic node led to a Type error. ## Versions and main components * PyMC3 Version: 3.6 * Theano Version: 1.0.3 * Python Version: 3.6.6 * Operating system: osX * How did you install PyMC3: (conda/pip) pip with the latest version from github",Maybe @lucianopaz has an idea?,theano.tensor as tt import import numpy as np from scipy.special import gammainc
rakudo/rakudo,https://github.com/rakudo/rakudo/issues/1905,rakudo_rakudo_issues_1905,"Not able to build on Windows 7 - 64bit.

***See [Newcomer Guide to Contributing to Core Perl 6](https://rakudo.party/post/Newcomer-Guide-to-Contributing-to-Core-Perl-6) for tips on fixing this Issue*** ---------------- ## The Problem Not able to build on Windows 7 - 64bit. ## Expected Behavior ## Actual Behavior Fail message  ## Steps to Reproduce 1) get source package 2018.05 2) Run configure command perl Configure.pl --gen-moar --gen-nqp --backends=moar ## Environment * Operating system: Win7 64bit ## Log build message",Which C compiler do you have?,***See [Newcomer Guide to Contributing to Core Perl 6](https://rakudo.party/post/Newcomer-Guide-to-Contributing-to-Core-Perl-6) for tips on fixing this Issue*** ----------------
greasemonkey/greasemonkey,https://github.com/greasemonkey/greasemonkey/issues/3020,greasemonkey_greasemonkey_issues_3020,"XMLHttpRequest/GM.xmlHttpRequest ignore cookies

My script works fine in scratchpad without any problem regardless without the workaround I was making a script and and i needed to fetch data from another page on the same site but this page requires you to be logged in to get the data, but when the request is made it acts as though i am not logged in when the request is made with XMLHttpRequest/GM.xmlHttpRequest everything is same origin complaint, but if i make a XMLHttpRequest via scratchpad it works as expected Changing this setting to this makes my script work: ![screenshot_2019-02-09_19-27-39](https://user-images.githubusercontent.com/564653/52528023-fcd94e00-2ca0-11e9-914c-20fb87d44bae.png) when a request is made via XMLHttpRequest/GM.xmlHttpRequest via GM cookie data is not transmitted when the browsers is set to only block cookies from sites that have not been visited, in spite of the target domain being the same as current domain, again this is not reproduce-able in a scratchpad only in GM",Could you clean up your question? It is a bit hard to read now...,", but when the request is made it acts as though i am not logged in when the request is made with XMLHttpRequest/GM.xmlHttpRequest everything is same origin complaint"
greasemonkey/greasemonkey,https://github.com/greasemonkey/greasemonkey/issues/3065,greasemonkey_greasemonkey_issues_3065,"Script does not load on raw.githubusercontent.com pages

**Update**: see https://github.com/greasemonkey/greasemonkey/issues/3065#issuecomment-583770358 <br> Try the following snippet of code on https://raw.githubusercontent.com/greasemonkey/greasemonkey/master/peg.txt and https://releases.llvm.org/2.8/LICENSE.TXT  It works on the latter license.txt file , but not the peg.txt (files on raw githubusercontent) Why? both have document.contentType == ""text/plain"" ![image](https://user-images.githubusercontent.com/5124946/70874610-e666e780-1f80-11ea-8fbd-dec340c3dd05.png) Firefox 71.0 Ubuntu 18.04","What (value of document.contentType) are you seeing, and what do you expect?",**Update**: see https://github.com/greasemonkey/greasemonkey/issues/3065#issuecomment-583770358 <br>
tornadoweb/tornado,https://github.com/tornadoweb/tornado/issues/2827,tornadoweb_tornado_issues_2827,"Python 3.7.5 AttributeError: module 'asyncio' has no attribute 'Future'

When running the starter code provided on the main page:  I get this error:  Installed tornado using: pip3 install tornado running Python 3.7.5","Could you provide more context? asyncio most definitely does have a Future attribute, so there's probably something else going on that we're not seeing in the above traceback.",When running the starter code provided on the main page: I get this error:  Installed tornado using: pip3 install tornado running Python 3.7.5
middleman/middleman,https://github.com/middleman/middleman/issues/2280,middleman_middleman_issues_2280,"url_for produces the wrong link in some cases with localized pages

## Expected behavior and actual behavior url_for produces the wrong link in some cases when used from localized pages. Apparently this happens when the following conditions are met: * url_for is being used from a localized URL for a language that is *not* mapped at root * The page name passed to url_for includes the page extension (e.g. products.html) ## Steps to reproduce the problem (from a clean middleman installation) Here's a test repo: https://github.com/guillerodriguez/middleman-url_for-test If you browse the index.html page in this repo, the results are as follows: - URL for index.html,en: / - URL for index.html,fr: /fr/ - URL for index.html,es: /es/ - URL for test.html,en: /test.html - URL for test.html,fr: /fr/test.html - URL for test.html,es: /es/test.html - URL for index,en: / - URL for index,fr: /fr/ - URL for index,es: /es/ - URL for test,en: /test.html - URL for test,fr: /fr/test.html - URL for test,es: /es/test.html These are all OK. However if you browse /es/index.html, the results are as follows: - URL for index.html,en: /es/ - URL for index.html,fr: /es/ - URL for index.html,es: /es/ - URL for test.html,en: /es/test.html - URL for test.html,fr: /es/test.html - URL for test.html,es: /es/test.html - URL for index,en: / - URL for index,fr: /fr/ - URL for index,es: /es/ - URL for test,en: /test.html - URL for test,fr: /fr/test.html - URL for test,es: /es/test.html In this case, the first 6 results are wrong. ## Additional information - Ruby version: 2.3.8p459 - Middleman version: 4.3.4 - OS version: Ubuntu 14",Would you be able to contribute a failing test case (like a tiny middleman repo which shows this behavior)? It'll make it much quicker to diagnose.," is being used from a localized URL for a language that is *not* mapped at root * The page name passed to url_for includes the page extension Here's a test repo: https://github.com/guillerodriguez/middleman-url_for-test If you browse the index.html page in this repo, the results are as follows: - URL for index.html,en: / - URL for index.html,fr: /fr/ - URL for index.html,es: /es/ - URL for test.html,en: /test.html - URL for test.html,fr: /fr/test.html - URL for test.html,es: /es/test.html - URL for index,en: / - URL for index,fr: /fr/ - URL for index,es: /es/ - URL for test,en: /test.html - URL for test,fr: /fr/test.html - URL for test,es: /es/test.html These are all OK. However if you browse /es/index.html, the results are as follows: - URL for index.html,en: /es/ - URL for index.html,fr: /es/ - URL for index.html,es: /es/ - URL for test.html,en: /es/test.html - URL for test.html,fr: /es/test.html - URL for test.html,es: /es/test.html - URL for index,en: / - URL for index,fr: /fr/ - URL for index,es: /es/ - URL for test,en: /test.html - URL for test,fr: /fr/test.html - URL for test,es: /es/test.html In this case, the first 6 results are wrong."
SpecFlowOSS/SpecFlow,https://github.com/SpecFlowOSS/SpecFlow/issues/1920,SpecFlowOSS_SpecFlow_issues_1920,"Feature files vanishes from project hierarchy on mac (.net Core)

### SpecFlow Version: - [X] 3.1 - [ ] 3.0 - [ ] 2.4 - [ ] 2.3 - [ ] 2.2 - [ ] 2.1 - [ ] 2.0 - [ ] 1.9 ### Used Test Runner - [ ] SpecFlow+Runner - [ ] MSTest - [X] NUnit - [ ] Xunit Version number: 3.15.1 ### Project Format of the SpecFlow project - [ ] Classic project format using packages.config - [X] Classic project format using <PackageReference> tags - [ ] Sdk-style project format ### .feature.cs files are generated using - [X] SpecFlow.Tools.MsBuild.Generation NuGet package - [ ] SpecFlowSingleFileGenerator custom tool ### Visual Studio Version - [X] VS 2019 - [ ] VS 2017 - [ ] VS 2015 ### Enable SpecFlowSingleFileGenerator Custom Tool option in Visual Studio extension settings - [ ] Enabled - [X] Disabled ### Are the latest Visual Studio updates installed? - [X] Yes - [ ] No, I use Visual Studio version <Major>.<Minor>.<Patch> <!-- e.g. 16.1.0 --> ### .NET Framework: - [ ] >= .NET 4.5 - [ ] before .NET 4.5 - [ ] .NET Core 2.0 - [ ] .NET Core 2.1 - [ ] .NET Core 2.2 - [ ] .NET Core 3.0 - [X] .NET Core 3.1 ### Test Execution Method: - [X] Visual Studio Test Explorer - [ ] TFS/VSTS/Azure DevOps – Task – PLEASE SPECIFY THE NAME OF THE TASK - [ ] Command line – PLEASE SPECIFY THE FULL COMMAND LINE ### Repro Project It's a simple .net core 3.1 with the packages added. I can provide if really necessary ### Issue Description Basically, whenever I open my solution on Mac and/or add a new feature file, they simply vanish from the project. If I navigate to the folder I can see them and I can readd it to the project (but if I close the solution they are gone again). If I build the solution, 2 feature.cs files are added to the project. This shows the project AFTER building (and when the feature has already vanished, meaning I opened the solution): <img width=""1414"" alt=""Screenshot 2020-03-23 at 10 38 09"" src=""https://user-images.githubusercontent.com/4673110/77308391-c9b21c80-6cf2-11ea-91e5-b5952634f103.png""> This shows the project in the folder <img width=""616"" alt=""Screenshot 2020-03-23 at 10 38 18"" src=""https://user-images.githubusercontent.com/4673110/77308412-d20a5780-6cf2-11ea-99ee-68ad496701ad.png""> ### Steps to Reproduce - Create a .net core 3.1 project on Mac - Add specflow, specflow.nunit, specflow.tools.msbuild.generation nuget packages - Create a new feature file. - Build solution. You won't see the feature.cs in the project hierarchy anymore and 2 feature.cs (code behind) added to it",Could you please post a screenshot?,"This shows the project AFTER building (and when the feature has already vanished, meaning I opened the solution): <img width=""1414"" alt=""Screenshot 2020-03-23 at 10 38 09"" src=""https://user-images.githubusercontent.com/4673110/77308391-c9b21c80-6cf2-11ea-91e5-b5952634f103.png""> This shows the project in the folder <img width=""616"" alt=""Screenshot 2020-03-23 at 10 38 18"" src=""https://user-images.githubusercontent.com/4673110/77308412-d20a5780-6cf2-11ea-99ee-68ad496701ad.png"">"
SpecFlowOSS/SpecFlow,https://github.com/SpecFlowOSS/SpecFlow/issues/1283,SpecFlowOSS_SpecFlow_issues_1283,"specflow error

<!-- PLEASE GIVE YOUR ISSUE A SENSIBLE NAME. This makes it easier to identify issues at a glance --> <!-- PLEASE CHECK THE OPTIONS THAT APPLY TO YOU BY ADDING AN 'x' TO THE CORRESPONDING CHECKBOX ('[ ]') --> ### SpecFlow Version: - [x ] 2.4 - [ ] 2.3 - [ ] 2.2 - [ ] 2.1 - [ ] 2.0 - [ ] 1.9 ### Used Test Runner - [x] SpecFlow+Runner - [ ] MSTest - [ ] NUnit - [ ] Xunit <!-- PLEASE INCLUDE THE VERSION NUMBER OF YOUR TEST RUNNER --> Version number: ### Visual Studio Version - [x] VS 2017 - [ ] VS 2015 - [ ] VS 2013 ### Are the latest Visual Studio updates installed? - [x] Yes - [ ] No ### .NET Framework: - [x] >= .NET 4 - [ ] before .NET 4 ### Test Execution Method: - [x] Visual Studio Test Explorer - [ ] TFS/VSTS – Task – PLEASE SPECIFY THE NAME OF THE TASK - [ ] Command line – PLEASE SPECIFY THE FULL COMMAND LINE ### &lt;SpecFlow> Section in app.config <!-- PLEASE COPY THE ENTRIE <SpecFlow> SECTION IN YOUR .config FILE AND PASTE IT BETWEEN THE TWO CODE MARKERS () BELOW -->  ### Repro Project <!-- PLEASE INCLUDE A LINK TO A PROJECT THAT DEMONSTRATES THE ISSUE YOU ARE REPORTING, IF POSSIBLE For information on how to include a useful repro, refer to https://stackoverflow.com/help/mcve --> ### Issue Description <!-- not sure why I get 290 syntax errors, my files have no syntax errors. all I did was create specflow default feature and generate its step definition by clicking such button--> ### Steps to Reproduce <!-- trying to build solution--> We could not find a data exchange file at the path System.Configuration.ConfigurationErrorsException: The element <unitTestProvider> may only appear once in this section. Please open an issue at https://github.com/techtalk/SpecFlow/issues/ Complete output: System.Configuration.ConfigurationErrorsException: The element <unitTestProvider> may only appear once in this section. Command: c:\users\miguel\appdata\local\microsoft\visualstudio\15.0_950c5d43\extensions\cyzqpedl.g1s\TechTalk.SpecFlow.VisualStudio.CodeBehindGenerator.exe Parameters: GenerateTestFile --featurefile C:\Users\Miguel\AppData\Local\Temp\tmp193F.tmp --outputdirectory C:\Users\Miguel\AppData\Local\Temp --projectsettingsfile C:\Users\Miguel\AppData\Local\Temp\tmp192F.tmp Working Directory: C:\Users\Miguel\source\repos\UnitTestProject4\packages\SpecFlow.2.4.0\tools *appconfig* ) BELOW -->  ### Repro Project <!-- PLEASE INCLUDE A LINK TO A PROJECT THAT DEMONSTRATES THE ISSUE YOU ARE REPORTING, IF POSSIBLE For information on how to include a useful repro, refer to https://stackoverflow.com/help/mcve --> ### Issue Description <!-- not sure why I get 290 syntax errors, my files have no syntax errors. all I did was create specflow default feature and generate its step definition by clicking such button--> ### Steps to Reproduce <!-- trying to build solution--> We could not find a data exchange file at the path System.Configuration.ConfigurationErrorsException: The element <unitTestProvider> may only appear once in this section. Please open an issue at https://github.com/techtalk/SpecFlow/issues/ Complete output: System.Configuration.ConfigurationErrorsException: The element <unitTestProvider> may only appear once in this section. Command: c:\users\miguel\appdata\local\microsoft\visualstudio\15.0_950c5d43\extensions\cyzqpedl.g1s\TechTalk.SpecFlow.VisualStudio.CodeBehindGenerator.exe Parameters: GenerateTestFile --featurefile C:\Users\Miguel\AppData\Local\Temp\tmp193F.tmp --outputdirectory C:\Users\Miguel\AppData\Local\Temp --projectsettingsfile C:\Users\Miguel\AppData\Local\Temp\tmp192F.tmp Working Directory: C:\Users\Miguel\source\repos\UnitTestProject4\packages\SpecFlow.2.4.0\tools *appconfig*",Do you have perhaps 2 entries for unitTestProvider?,"*appconfig* <?xml version=""1.0"" encoding=""utf-8""?> <configuration> <configSections> <section name=""specFlow"" type=""TechTalk.SpecFlow.Configuration.ConfigurationSectionHandler, TechTalk.SpecFlow"" /> </configSections> <specFlow> <!-- For additional details on SpecFlow configuration options see http://go.specflow.org/doc-config --> <!-- For additional details on SpecFlow configuration options see http://go.specflow.org/doc-config --><!-- use unit test provider SpecRun+NUnit or SpecRun+MsTest for being able to execute the tests with SpecRun and another provider --><!-- For additional details on SpecFlow configuration options see http://go.specflow.org/doc-config --><unitTestProvider name=""SpecRun"" /><plugins> <add name=""SpecRun"" /> </plugins><unitTestProvider name=""NUnit"" /></specFlow> </configuration>"
SpecFlowOSS/SpecFlow,https://github.com/SpecFlowOSS/SpecFlow/issues/1801,SpecFlowOSS_SpecFlow_issues_1801,"SpecFlow 3 tests don't success when executed (works when debugging)

<!-- PLEASE CHECK THE OPTIONS THAT APPLY TO YOU BY ADDING AN 'x' TO THE CORRESPONDING CHECKBOX ('[ ]') --> ### SpecFlow Version: - [x] 3.1.76 - [x] 3.1.67 - [ ] 3.0 - [ ] 2.4 - [ ] 2.3 - [ ] 2.2 - [ ] 2.1 - [ ] 2.0 - [ ] 1.9 Checked with both versions ### Used Test Runner - [ ] SpecFlow+Runner - [ ] MSTest - [x] NUnit - [ ] Xunit <!-- PLEASE INCLUDE THE VERSION NUMBER OF YOUR TEST RUNNER --> Version number: ### Project Format of the SpecFlow project - [x] Classic project format using packages.config - [ ] Classic project format using <PackageReference> tags - [ ] Sdk-style project format ### .feature.cs files are generated using - [x] SpecFlow.Tools.MsBuild.Generation NuGet package - [ ] SpecFlowSingleFileGenerator custom tool ### Visual Studio Version - [x] VS 2019 - [ ] VS 2017 - [ ] VS 2015 ### Enable SpecFlowSingleFileGenerator Custom Tool option in Visual Studio extension settings - [ ] Enabled - [X] Disabled ### Are the latest Visual Studio updates installed? - [x] Yes - [ ] No, I use Visual Studio version <Major>.<Minor>.<Patch> <!-- e.g. 16.1.0 --> ### .NET Framework: - [x] >= .NET 4.5 - [ ] before .NET 4.5 - [ ] .NET Core 2.0 - [ ] .NET Core 2.1 - [ ] .NET Core 2.2 - [ ] .NET Core 3.0 ### Test Execution Method: - [x] Visual Studio Test Explorer - [ ] TFS/VSTS/Azure DevOps – Task – PLEASE SPECIFY THE NAME OF THE TASK - [ ] Command line – PLEASE SPECIFY THE FULL COMMAND LINE ### &lt;SpecFlow> Section in app.config or content of specflow.json <!-- PLEASE COPY THE ENTIRE <SpecFlow> SECTION IN YOUR .config FILE or THE ENTRIE specflow.json AND PASTE IT BETWEEN THE TWO CODE MARKERS () BELOW -->  ### Repro Project None ### Issue Description This issue only started after migration to specflow 3.1. With multiple Features, when running the tests in TestExplorer, the first set of steps pass successfully under the feature, however when the next feature starts it fails (and for all subsequent features). The strange part is if I run in debug (without any breakpoints anywhere) the tests all execute successfully. ### Steps to Reproduce <!-- PLEASE DESCRIBE THE STEPS REQUIRED TO REPRODUCE THIS ISSUE, IF POSSIBLE --> My issue could very well be an incompatible package that is being loaded. ### packages.config  ### Exception Message  ### Disclaimer Please note that this an older specflow implementation specific to our use case. However I've cut down the whole project to two features, Feature1 and Feature2. To rule out any other strange bits such as incorrectly implemented attributes or anything. I have removed all references to other tests and any hooks. This is basically back to two barebone feature files.) BELOW -->  ### Repro Project None ### Issue Description This issue only started after migration to specflow 3.1. With multiple Features, when running the tests in TestExplorer, the first set of steps pass successfully under the feature, however when the next feature starts it fails (and for all subsequent features). The strange part is if I run in debug (without any breakpoints anywhere) the tests all execute successfully. ### Steps to Reproduce <!-- PLEASE DESCRIBE THE STEPS REQUIRED TO REPRODUCE THIS ISSUE, IF POSSIBLE --> My issue could very well be an incompatible package that is being loaded. ### packages.config  ### Exception Message  ### Disclaimer Please note that this an older specflow implementation specific to our use case. However I've cut down the whole project to two features, Feature1 and Feature2. To rule out any other strange bits such as incorrectly implemented attributes or anything. I have removed all references to other tests and any hooks. This is basically back to two barebone feature files.",Could you create a small example project where this issue is reproducible?,76 - [x] 3.1.Checked with both versions
thorsten/phpMyFAQ,https://github.com/thorsten/phpMyFAQ/issues/1489,thorsten_phpMyFAQ_issues_1489,"Wrong Counter for inactive FAQs

The inactive counter in the overview of the faqs doesn't count correctly. See at the attached screenshot. ![screenshot 2018-09-09 um 10 54 21](https://user-images.githubusercontent.com/9133042/45262903-51417e80-b420-11e8-8b57-4569ab38d30a.png) The problem occur under 2.9.10 and 2.9.11 with the browser Safari 11.1.2 if you mix the manually activate faq and all activate in the title.",Did you checked the issue against 2.9.11 as well?,and 2.9.11 with the browser Safari 11.1.2
