repo,issue_link,issue_id,post,question,answer
gradle/gradle,https://github.com/gradle/gradle/issues/9319,gradle_gradle_issues_9319,"gradle metata doesn't work smoothly with 403's (s3+cloudfront)

 Arguably the problem here is that when you put cloudfront in front of an s3 bucket, instead of returning the appropriate 404 on not found, it returns a secure 403... I can see an argument that it is aws that needs to change but... good luck with that? It might be nice to have a flag, or simply treat 403's the same way instead of bailing out.  failure is permanent. I think it would be nice if gradle treated 403's and 404's the same as in both cases you're unable to retrieve the metadata, so simply treat it like it doesn't exist.",Can you please add the Gradle version and whether this is transient or permanent? Also what you would expect Gradle to do?,"affects 5.3.0-5.4.0, failure is permanent. I think it would be nice if gradle treated 403's and 404's the same as in both cases you're unable to retrieve the metadata, so simply treat it like it doesn't exist."
gradle/gradle,https://github.com/gradle/gradle/issues/5835,gradle_gradle_issues_5835,"Remove javax.annotation package & sub-packages from gradle-api-<version>.jar

Remove javax.annotation package & sub-packages from gradle-api-<version>.jar. They cause duplicate package problems with the module path. Would be preferable to have transitive dependencies on an artifact like com.google.code.findbugs:jsr305. Maybe some additional packages should also be removed from that jar, like javax.inject & javax.xml*.",What's your use case for running with gradle-api-<version>.jar on the module path?,Would be preferable to have transitive dependencies on an artifact like com.google.code.findbugs:jsr305.
gradle/gradle,https://github.com/gradle/gradle/issues/7603,gradle_gradle_issues_7603,"Gradle doesn't stop forked .bat files

<!--- Please follow the instructions below. We receive dozens of issues every week, so to stay productive, we will close issues that don't provide enough information. Please open Android-related issues on the Android Issue Tracker at https://source.android.com/source/report-bugs Please open Kotlin DSL-related issues at https://github.com/gradle/kotlin-dsl/issues Please open Gradle Native-related issues at https://github.com/gradle/gradle-native/issues --> <!--- Provide a brief summary of the issue in the title above --> When a program is started by Gradle and is long-running, and the user presses ctrl-c during that time, Gradle is killed but the subprocess started by Gradle keeps running. NOTE 1: This seems to affect Windows only! NOTE 2: This also only seems to affect bat scripts started by Gradle, not executables. So Gradle -> bat -> exe leaves the exe running on ctrl-c. ### Expected Behavior <!--- If you're describing a bug, tell us what should happen --> <!--- If you're suggesting a change/improvement, tell us how it should work --> Both Gradle and Python exits. ### Current Behavior <!--- If describing a bug, tell us what happens instead of the expected behavior --> <!--- If suggesting a change/improvement, explain the difference from current behavior --> Gradle exits, but Python keeps running: ![image](https://user-images.githubusercontent.com/1163299/47909468-493a1400-de90-11e8-8d31-ed887e98ee81.png) ### Context <!--- How has this issue affected you? What are you trying to accomplish? --> <!--- Providing context helps us come up with a solution that is most useful in the real world --> It causes the following: Access denied problems (because files are kept locked), memory leak issues, build errors ### Steps to Reproduce (for bugs) <!--- Provide a self-contained example project (as an attached archive or a Github project). --> <!--- In the rare cases where this is infeasible, we will also accept a detailed set of instructions. --> File: freeze.py  File: build.gradle  File: python.bat  1. Put the files build.gradle, python.bat and freeze.py into the same directory, with contents copied from above. 2. Start cmd.exe 3. Chdir into the directory 4. Enter gradle dummy 5. Press ctrl+c ### Your Environment <!--- Include as many relevant details about the environment you experienced the bug in --> <!--- A build scan https://scans.gradle.com/get-started is ideal --> * Build scan URL:  NOTE: Gradle 5/nightly is also affected",Can you please clarify?,"1 NOTE 2: This also only seems to affect bat scripts started by Gradle, not executables. So Gradle -> bat -> exe leaves the exe running on ctrl-c..batFile: python.bat  , python.bat"
gradle/gradle,https://github.com/gradle/gradle/issues/7941,gradle_gradle_issues_7941,"Gradle 5 does not pick annotation processor from project dependency

<!--- Please follow the instructions below. We receive dozens of issues every week, so to stay productive, we will close issues that don't provide enough information. Please open Android-related issues on the Android Issue Tracker at https://source.android.com/source/report-bugs Please open Kotlin DSL-related issues at https://github.com/gradle/kotlin-dsl/issues Please open Gradle Native-related issues at https://github.com/gradle/gradle-native/issues --> <!--- Provide a brief summary of the issue in the title above --> My project has subprojects that are generating different artifacts. Among those, the subproject of interest are * model - contains annotations that will be used in other sub-projects * model-processor - contains annotation processor that generates sources for any class found with the annotations from model subproject * consumer - contains classes annotated with annotations from model subproject that should be accompanied by sources generated by annotation processor from model-processor subproject. The build.gradle for consumer sub-project looks like  ### Expected Behavior <!--- If you're describing a bug, tell us what should happen --> <!--- If you're suggesting a change/improvement, tell us how it should work --> I expect to find the generated sources under ﻿consumer/build/generated/source/apt/main ### Current Behavior <!--- If describing a bug, tell us what happens instead of the expected behavior --> <!--- If suggesting a change/improvement, explain the difference from current behavior --> I am not getting the files generated under consumer/build/generated/source/apt/main with the Gradle 5.0. I do get the annotation processor to work with the same build script and Gradle 4.10.2. ### Context <!--- How has this issue affected you? What are you trying to accomplish? --> <!--- Providing context helps us come up with a solution that is most useful in the real world --> I am trying to switch to Gradle 5 from Gradle 4.10.2 where the generation works. If I cannot get the annotation processor to work, I cannot migrate. ### Steps to Reproduce (for bugs) <!--- Provide a self-contained example project (as an attached archive or a Github project). --> <!--- In the rare cases where this is infeasible, we will also accept a detailed set of instructions. --> Clone https://github.com/ishaigor/annotation-processor-sample Follow the steps in README ### Your Environment <!--- Include as many relevant details about the environment you experienced the bug in --> <!--- A build scan https://scans.gradle.com/get-started is ideal --> * Build scan URL: * https://gradle.com/s/sremu47v5j5kk - non working 5.0 * https://gradle.com/s/5pa5eu7fsrnic - working 4.10.2",Could you share the build you're seeing this in? @marcphilipp @oehme anything obvious to check?,Clone https://github.com/ishaigor/annotation-processor-sample Follow the steps in README
gradle/gradle,https://github.com/gradle/gradle/issues/12016,gradle_gradle_issues_12016,"strictly does not override constraint version from a project dependency

### Expected Behavior When a project depends on another project with a constraint version, it should be able to downgrade the version using strictly. ### Current Behavior Another project's constraint version cannot be downgraded and the build fails to resolve versions. There doesn't seem to be a way to exclude the constraints either. ### Context I use constraints to apply dependency management to projects in a multi-project build. There is one set of versioned dependencies and all projects have the versions applied using something like  This means that many constraints are added to projects even though there is no dependency declaration. I found that when adding a project dependency, all of it's constraints are applied even if the project does not have a dependency matching them. This means that for dependency A, there is no way to exclude the transitive dependency A from this project dependency - it is not a listed dependency, but it's constraint is applied either way. This would be fine, but it seems that strictly does not override the version in this case. force works fine, but is deprecated https://docs.gradle.org/current/userguide/dependency_downgrade_and_exclude.html#forced_dependencies_vs_strict_dependencies The language ""If, for some reason, you can’t use strict versions, you can force a dependency doing this:"" makes me think that this is not an intended case. ### Steps to Reproduce ~~- git clone https://github.com/anuraaga/gradle-constraint-overrides~~ ~~- cd gradle-constraint-overrides~~ ~~- ./gradlew :consumer:dependencies~~ Apologies for the complex example, my attempt above at simplifying it didn't reproduce yet. - git clone https://github.com/anuraaga/armeria/ - git fetch origin modern-gradle - git checkout modern-gradle - Comment out https://github.com/anuraaga/armeria/blob/modern-gradle/thrift0.9/build.gradle#L14 - ./gradlew :thrift0.9:dependencies --configuration compileClasspath - Note the thrift dependencies have FAILED to resolve ### Your Environment <!--- Include as many relevant details about the environment you experienced the bug in --> <!--- A build scan https://scans.gradle.com/get-started is ideal --> Build scan URL: https://gradle.com/s/s3hab734ooyzi",Do I miss something?,"~~~~ Apologies for the complex example, my attempt above at simplifying it didn't reproduce yet. - git clone https://github.com/anuraaga/armeria/ - git fetch origin modern-gradle - git checkout modern-gradle - Comment out https://github.com/anuraaga/armeria/blob/modern-gradle/thrift0.9/build.gradle#L14 - ./gradlew :thrift0.9:dependencies --configuration compileClasspath"
gradle/gradle,https://github.com/gradle/gradle/issues/9664,gradle_gradle_issues_9664,"Are up-to-date checks and incremental java compilation not meant to be used on CI servers?

**UPDATE:** Today I finally was able to get incremental Java compilation and UP-TO-DATE checks to work across machines by caching directories I listed below (initially, I had an error in dir moving logic). Although, my question remains: are these features not meant to be used on CI? If so, why? What made me ask this question: I figured that these features [require your BUILD_DIR to be an absolute path which does not change between builds](https://github.com/gradle/gradle/issues/9337), and this may be hard to achieve in CI environments. Also, it's not immediately clear which folders need to be cached in order for these features to work, so a user has to do some guesswork here. **ORIGINAL TEXT** I am trying to make incremental build (up-to-date checks) and incremental java compilation to work on CI servers. After spending significant time on these attempts, I feel like I can't make any progress on my own and need advice from the community. Maybe these features were never meant to work across machines? I know that the build cache feature was made to address this, but it works as ""all-or-nothing"" cache and does not provide incremental compilation. I am using Gradle Wrapper 5.4.1 and Gradle 5.4.1. I am using standard compileJava task. Here's a list of directories I cache across my build runners: 1. GRADLE_USER_HOME/caches (absolute path, same on all runners) 2. PROJECT_DIR/.gradle (different path on each runner because PROJECT_DIR contains runner id) 3. BUILD_DIR (absolute path, same on all runners) When compileJava starts on a new runner, it simply deletes cached classes as stale, saying:  Both features work locally. I also tried moving the project folder to emulate PROJECT_DIR change across runners, features still work. Moreover, I tried sending archived PROJECT_DIR folder to my colleague, and to my surprise, incremental build and compilation worked across our machines. But since Gradle does not give any insight into why files are considered stale, I can't figure out why it does not work on CI. I am using Gitlab CI, Gradle builds run inside a Docker container, but there's no magic going on there AFAIK, so everything should work the same way it does between my and colleague's machines.","Why not use the build cache, which is designed exactly for this use case?","**UPDATE:** Today I finally was able to get incremental Java compilation and UP-TO-DATE checks to work across machines by caching directories I listed above. Although, my question remains: are these features not meant to be used on CI? And if so, why? **ORIGINAL TEXT**"
gradle/gradle,https://github.com/gradle/gradle/issues/11412,gradle_gradle_issues_11412,"Gradle 6.0 generates incorrect versions for Kotlin multiplatform projects when publishing to Bintray

<!--- Please use our bug report template to report problems with something that has never worked. Regressions reports are greatly appreciated during our RC phase and before a final release. --> <!--- Provide a brief summary of the issue in the title above --> ### Expected Behavior When publishing a Kotlin multiplatform project to Bintray using the maven-publish plugin, only one version should be created, that being the project's version. All artifacts should then be published to that version in Bintray. This was the case in Gradle versions before 6.0. In practice, for a package logkat with two platform targets (JVM and linux-x64) and a version of 0.5.0, the correct Bintray output would be: ![image](https://user-images.githubusercontent.com/12981608/69076352-45c4ec80-0a01-11ea-8d52-4c3db2c3761c.png) ### Current Behavior In Gradle 6.0, a version is created for the project's version, but then versions are created for each artifact. In practice, for a package logkat with two platform targets (JVM and linux-x64) and a version of 0.5.0, the putput for Gradle 6.0 is: ![image](https://user-images.githubusercontent.com/12981608/69076595-d3a0d780-0a01-11ea-9b75-c424adce5a28.png) ### Context This issue happens with Gradle 6.0 only. All previous versions do not have this issue. The ""correct"" output is from Gradle 5.6.3. ### Steps to Reproduce My project at https://gitlab.com/serebit/logkat currently has a Gradle 6.0 wrapper, and generates the above when publishing to its ""snapshot"" repository. ### Your Environment This happens both on my Linux desktop and in GitLab CI, using OpenJDK 8 or OpenJDK 11.",Could you try with Gradle 5.6.4 since 5.6 is when we introduced that parallelism?,"The ""correct"" output is from Gradle 5.6.3."
