repo,issue_link,issue_id,post,question,answer
ansible/ansible,https://github.com/ansible/ansible/issues/45045,ansible_ansible_issues_45045,"Tasks tagged [always,b] are skipped by --skip-tags b

<!--- Verify first that your issue/request is not already reported on GitHub. THIS FORM WILL BE READ BY A MACHINE, COMPLETE ALL SECTIONS AS DESCRIBED. Also test if the latest release, and devel branch are affected too. ALWAYS add information AFTER (OUTSIDE) these html comments. Otherwise it may end up being automatically closed by our bot. --> ##### SUMMARY Tasks tagged 'always' should be skipped only if you do --skip-tags always ##### ISSUE TYPE <!--- Pick one below and delete the rest --> - ~Bug Report~ - Feature Idea ##### COMPONENT NAME <!--- Insert, BELOW THIS COMMENT, the name of the module, plugin, task or feature. Do not include extra details here, e.g. ""vyos_command"" not ""the network module vyos_command"" or the full path--> core ##### ANSIBLE VERSION <!--- Paste, BELOW THIS COMMENT, verbatim output from ""ansible --version"" between quotes below -->  ##### CONFIGURATION <!--- If using Ansible 2.4 or above, paste, BELOW THIS COMMENT, the results of ""ansible-config dump --only-changed"" Otherwise, mention any settings you have changed/added/removed in ansible.cfg (or using the ANSIBLE_* environment variables).--> N/A ##### OS / ENVIRONMENT <!--- Mention, BELOW THIS COMMENT, the OS you are running Ansible from, and the OS you are managing, or say ""N/A"" for anything that is not platform-specific. Also mention the specific version of what you are trying to control, e.g. if this is a network bug the version of firmware on the network device.--> N/A ##### STEPS TO REPRODUCE <!--- For bugs, show exactly how to reproduce the problem, using a minimal test-case. For new features, show how the feature would be used. --> I noticed when testing the new ""apply"" feature that tasks tagged with [always,b] were being skipped by --skip-tags b, which should not happen per playbooks_tags.rst. I looked at evaluate_tags, and found that it does this:  Because the 'always' not in tags or 'always' in skip_tags test is wrapped in the 'all' in skip_tags test, it doesn't work as intended. Indeed, if you do --skip-tags all,b, then tasks tagged with [always,b] are **NOT** skipped, as I would expect. However, the all skip-tags is neither documented, nor does --skip-tags all,b make sense from a UI perspective. If I change the code to:  …then it behaves exactly as I would expect. Having ""always""-tagged tasks be skipped based on an ""apply""-ed tag is not helpful behaviour, and is contrary to the documentation (and intuition based on the meaning of ""always"" in general). I have looked for some explanation of the rationale for this change in commit messages etc., but have been unable to find anything. Therefore I think it's clearly a bug, and evaluate_tags() should be changed as described above. <!--- Paste example playbooks or commands between quotes below -->  <!--- You can also paste gist.github.com links for larger files --> ##### EXPECTED RESULTS <!--- What did you expect to happen when running the steps above? --> The task should have been run. ##### ACTUAL RESULTS <!--- What actually happened? If possible run with extra verbosity (-vvvv) --> The task was skipped. <!--- Paste verbatim command output between quotes below -->",What's the point of using always and another tag together on a task?,~ ~ - Feature Idea
ansible/ansible,https://github.com/ansible/ansible/issues/67784,ansible_ansible_issues_67784,"cloudflare_dns: TXT idempotency

##### SUMMARY 1. Using solo=true with type=TXT **replaces all other TXT records** for that domain (or APEX) and may break the domain in various ways 2. Using solo=false with type=TXT create **duplicated** TXT records of the same value for the same subdomain (or APEX). But: - A given domain (or subdomain) often has multiple TXT records, and often on the APEX. - Emptying all TXT records is simply unacceptable - Neither is duplicating records (can break many feature, like website verification or SPF which do not deal with or tolerate multiple records) - Ansible cloudflare_dns module finds its very use in managing multiple records situation. ##### ISSUE TYPE - Feature Idea ##### COMPONENT NAME cloudflare_dns ##### ADDITIONAL INFORMATION Suggestion: If: - solo=true - and type=TXT - and value contains (.+)= ... then uniqueness among the various existing TXT records should be ensured on the basis of such value's prefix. Would work for SPF (v=spf1) and (facebook|google|...)-site-verification= See also #31511","When you talk about duplicates you don't talk about actual duplicate identical TXT records, but rather duplicates on a usage/prefix level? Such as two different ""v=spf1 ..."" records?","). But: - A given domain (or subdomain) often has multiple TXT records, and often on the APEX or tolerate"
ansible/ansible,https://github.com/ansible/ansible/issues/50583,ansible_ansible_issues_50583,"buildah connection doesn't work with rootless buildah & fuse-overlay

##### SUMMARY Edit: **resolved**; just wrap the playbook invocation with buildah unshare, like this:  ---- When using rootless buildah and fuse-overlay together, buildah's mount command doesn't function due to a kernel limitation. This completely breaks the connection plugin since mount is the first thing that happens. We have tracked the original issue at buildah's side: https://github.com/containers/buildah/issues/1225, check it out for the technical details. Sadly, buildah devs decided to disable the mount command for such setup which means that buildah conn can't work in that environment. @giuseppe posted a way around the issue by utilizing buildah unshare. I haven't checked whether it would be possible to fix the connection plugin with such approach. I am creating this issue for sake of tracking the limitation. ##### ISSUE TYPE - Bug Report ##### COMPONENT NAME plugin/connection/buildah ##### ANSIBLE VERSION <!--- Paste verbatim output from ""ansible --version"" between quotes -->  ##### OS / ENVIRONMENT Fedora 29 ##### ACTUAL RESULTS",Could you run ansible in a sidecar container within the same user namespace to allow this access?,"Edit: **resolved**; just wrap the playbook invocation with buildah unshare, like this:  ----"
ansible/ansible,https://github.com/ansible/ansible/issues/42030,ansible_ansible_issues_42030,"Speed up Ansible for Network Modules?

<!--- Verify first that your issue/request is not already reported on GitHub. THIS FORM WILL BE READ BY A MACHINE, COMPLETE ALL SECTIONS AS DESCRIBED. Also test if the latest release, and devel branch are affected too. ALWAYS add information AFTER (OUTSIDE) these html comments. Otherwise it may end up being automatically closed by our bot. --> ##### SUMMARY Running ansible network module is slow on Network Devices. Is there a way to speed up the process? I have used parameters like: controlPersist strategy: free pipelining=True ##### ISSUE TYPE <!--- Pick one below and delete the rest --> - Feature Idea ##### COMPONENT NAME <!--- Insert, BELOW THIS COMMENT, the name of the module, plugin, task or feature. Do not include extra details here, e.g. ""vyos_command"" not ""the network module vyos_command"" or the full path--> ios_config nxos_config eos_config ios_command nxos_command eos_command ##### ANSIBLE VERSION <!--- Paste, BELOW THIS COMMENT, verbatim output from ""ansible --version"" between quotes below -->  ##### CONFIGURATION <!--- If using Ansible 2.4 or above, paste, BELOW THIS COMMENT, the results of ""ansible-config dump --only-changed"" Otherwise, mention any settings you have changed/added/removed in ansible.cfg (or using the ANSIBLE_* environment variables).--> ##### OS / ENVIRONMENT <!--- Mention, BELOW THIS COMMENT, the OS you are running Ansible from, and the OS you are managing, or say ""N/A"" for anything that is not platform-specific. Also mention the specific version of what you are trying to control, e.g. if this is a network bug the version of firmware on the network device.--> Red Hat Enterprise Linux Server release 6.9 (Santiago) ##### STEPS TO REPRODUCE <!--- For bugs, show exactly how to reproduce the problem, using a minimal test-case. For new features, show how the feature would be used. --> <!--- Paste example playbooks or commands between quotes below -->  <!--- You can also paste gist.github.com links for larger files --> ##### EXPECTED RESULTS <!--- What did you expect to happen when running the steps above? --> Faster results for running on 1000 nodes simultaneously. ##### ACTUAL RESULTS <!--- What actually happened? If possible run with extra verbosity (-vvvv) --> <!--- Paste verbatim command output between quotes below -->",Do you have changed forks configuration (default 5)?,"<!--- Verify first that your issue/request is not already reported on GitHub. THise it mSIBLE VERSION <!--- Paste, BELOW THIS COMMENT, verbatim output from ""ansible --version"" b8, Ansible 2.4 or above, paste, BELOW THIS COMMENT, the results of ""ansible-config dump --onl <!--- You can also paste gist.github.com links for larger files --> ##### EXPECTED RESULTS <!--- What did you expect to happen when running the steps above? --> Faster results for running on 1000 nodes simultaneously. ##### ACTUAL RESULTS <!--- What actually happened? If possible run with extra verbosity (-vvvv) --> <!--- Paste verbatim command output between quotes below --> "
ansible/ansible,https://github.com/ansible/ansible/issues/48108,ansible_ansible_issues_48108,"[Errno 2] No such file or directory - thrown when executing a command

<!--- Verify first that your issue is not already reported on GitHub --> <!--- Also test if the latest release and devel branch are affected too --> <!--- Complete *all* sections as described, this form is processed automatically --> ##### SUMMARY <!--- Explain the problem briefly below --> [Errno 2] No such file or directory is thrown when executing a command or a shell instruction, might be something i missed. ##### ISSUE TYPE - Bug Report ##### COMPONENT NAME <!--- Write the short name of the module, plugin, task or feature below --> ##### ANSIBLE VERSION <!--- Paste verbatim output from ""ansible --version"" between quotes -->  ##### CONFIGURATION <!--- Paste verbatim output from ""ansible-config dump --only-changed"" between quotes -->  ##### OS / ENVIRONMENT <!--- Provide all relevant information below, e.g. target OS versions, network device firmware, etc. --> macOS mojave ##### STEPS TO REPRODUCE <!--- Describe exactly how to reproduce the problem, using a minimal test-case --> <!--- Paste example playbooks or commands between quotes below -->  <!--- HINT: You can paste gist.github.com links for larger files --> ##### EXPECTED RESULTS <!--- Describe what you expected to happen when running the steps above --> To work ##### ACTUAL RESULTS <!--- Describe what actually happened. If possible run with extra verbosity (-vvvv) --> <!--- Paste verbatim command output between quotes -->",What is the value of hostvars['KUBERNETES_TOKEN_HOLDER']['token'] ? needs_info,"- name: Fetching join command for workers shell: kubeadm token create --print-join-command register: join_command_output - name: Setting a up a dummy host to store the join command to work on cross tasks add_host: name: ""KUBERNETES_TOKEN_HOLDER"" token: ""{{join_command_output.stdout_lines}}"" --------"
ansible/ansible,https://github.com/ansible/ansible/issues/49956,ansible_ansible_issues_49956,"WinRM

<!--- Verify first that your issue is not already reported on GitHub --> <!--- Also test if the latest release and devel branch are affected too --> <!--- Complete *all* sections as described, this form is processed automatically --> ##### SUMMARY <!--- Explain the problem briefly below --> I am trying to setup communication between ansible and windows server, when i try to run the playbook i am getting below error, I have enable port 5985 in windows server and enable liseners on HTTP port, and Authentication i am using is BASIC. ##### ISSUE TYPE - Bug Report WinRM connection Error ##### COMPONENT NAME <!--- Write the short name of the module, plugin, task or feature below, use your best guess if unsure --> ##### ANSIBLE VERSION <!--- Paste verbatim output from ""ansible --version : 2.7.4"" between quotes -->  ##### CONFIGURATION <!--- Paste verbatim output from ""ansible-config dump --only-changed"" between quotes -->  ##### OS / ENVIRONMENT <!--- Provide all relevant information below, e.g. target OS versions, network device firmware, etc. --> Target OS is windows 2016 ##### STEPS TO REPRODUCE <!--- Describe exactly how to reproduce the problem, using a minimal test-case --> <!--- Paste example playbooks or commands between quotes below -->  <!--- HINT: You can paste gist.github.com links for larger files --> ##### EXPECTED RESULTS <!--- Describe what you expected to happen when running the steps above --> ##### ACTUAL RESULTS <!--- Describe what actually happened. If possible run with extra verbosity (-vvvv) --> <!--- Paste verbatim command output between quotes -->",Can you post steps to reproduce? E. G. What you've pre configured on your windows server?,"ansible-playbook main.yml -vvvvv PLAYBOOK: main.yml********** 1.Plays in main.yml PLAY [webserver]**************** TASK [Gathering Facts]**************** Using module file /usr/lib/python2.7/sitepackages/ansible/modules/windows/setup.ps1 <ssk.com> ESTABLISH WINRM CONNECTION FOR USER: sateesh on PORT 5985 to ssk.com Checking if winrm_host ssk.com is an IPV6 address <ssk.com> WINRM CONNECT: transport=basic endpoinnt=http://ssk.com:5985/wsman <ssk.com> WINRM CONNECTION ERROR: Bad HTTP response returned from server. Code 404 Trackback (most recent call last): File""/user/lib/python2.7/sitepackages/ansible/plugins/connection/winrm.py"", line 400, in _winrm_connection self.shall_id+ protocal.open_shell(codepage=65001) # UTF-8 File""/user/lib/python2.7/sitepackages/winrm/protocal.py"" Line 157, in open_shell res = self.send_message (xmltodict.unphase(req)) File""/user/lib/python2.7/sitepackages/winrm/protocal.py"" Line 242, in send_messgae raise ex WINRMTransportError: Bad HTTP response return from server. Code 404"
ansible/ansible,https://github.com/ansible/ansible/issues/50147,ansible_ansible_issues_50147,"get_url + cookie: accept licence not downloading ansible < 2.6

##### SUMMARY get_url + cookie: accept licence does not download file correctly with ansible < 2.6. I tried nearly every Version from 2.4.3.0 up to 2.6 with virtual envs. Edit: **From Version 2.6 this bug doesnt occur.** ##### ISSUE TYPE - Bug Report ##### COMPONENT NAME get_url ##### ANSIBLE VERSION  ##### CONFIGURATION  ##### OS / ENVIRONMENT Linux/Mac OS ##### STEPS TO REPRODUCE <!--- Describe exactly how to reproduce the problem, using a minimal test-case --> <!--- Paste example playbooks or commands between quotes below --> This playbook:  <!--- HINT: You can paste gist.github.com links for larger files --> ##### EXPECTED RESULTS  ##### ACTUAL RESULTS",Can you post verbose output from ansible-playbook execution with -vvv parameter?,Edit: **From Version 2.6 this bug doesnt occur.**
ansible/ansible,https://github.com/ansible/ansible/issues/56987,ansible_ansible_issues_56987,"VMware: vmware_guest_powerstate fails when VM name is too long

<!--- Verify first that your issue is not already reported on GitHub --> <!--- Also test if the latest release and devel branch are affected too --> <!--- Complete *all* sections as described, this form is processed automatically --> ##### SUMMARY <!--- Explain the problem briefly below --> When user has a VM with long name then vmware_guest_powerstate fails with -  warning ##### ISSUE TYPE - Bug Report ##### COMPONENT NAME <!--- Write the short name of the module, plugin, task or feature below, use your best guess if unsure --> vmware_guest_powerstate ##### ANSIBLE VERSION <!--- Paste verbatim output from ""ansible --version"" between quotes -->  ##### CONFIGURATION <!--- Paste verbatim output from ""ansible-config dump --only-changed"" between quotes -->  ##### OS / ENVIRONMENT <!--- Provide all relevant information below, e.g. target OS versions, network device firmware, etc. --> ##### STEPS TO REPRODUCE <!--- Describe exactly how to reproduce the problem, using a minimal test-case --> <!--- Paste example playbooks or commands between quotes below -->  <!--- HINT: You can paste gist.github.com links for larger files --> ##### EXPECTED RESULTS <!--- Describe what you expected to happen when running the steps above --> ##### ACTUAL RESULTS <!--- Describe what actually happened. If possible run with extra verbosity (-vvvv) --> <!--- Paste verbatim command output between quotes -->",Can you please add reproducer playbook ?,"When user has a VM with long name then vmware_guest_powerstate fails with -  warning vmware_guest_powerstate--- - hosts: localhost tasks: - name: reboot at time vmware_guest_powerstate: hostname: ******** username: ******** password: ""*******"" validate_certs: no folder: ""/"" name: ""formentor_SHsiebdb01"" state: restarted scheduled_at: ""27/05/2019 14:20"""
ansible/ansible,https://github.com/ansible/ansible/issues/69043,ansible_ansible_issues_69043,"feature request: inventory plugins support yaml references in ""compose""

##### SUMMARY It would be handy if inventory plugins would support yaml references **in compose** (for settings with string values). This would allow to pass on settings to variables (see ADDITIONAL INFORMATION for an example): ##### ISSUE TYPE - Feature Idea ##### COMPONENT NAME inventory plugin ##### ADDITIONAL INFORMATION example inventory showing how settings could be passed to variables: inventory/yyy.yaml  This does not work because compose expects jinja2 expressions. When strings are passed, they are interpreted as variables. And I see no way to put quotes around *inventory_hostname_value or tell compose that the value is a string. ##### suggestion Feature request: Please provide a way to use (string) setting values as variables. * by allowing something like this  * by defining another section:  <hr/> ##### old info I do not get an error *(because strict is not set)*, but I do not see the variables settings_1 and setting_of_inventory_hostname. Currently I can copy the values manually, which is error prone. ansible version: 2.9.4 yaml syntax for saml references: https://en.wikipedia.org/wiki/YAML#Syntax or https://yaml.org/spec/1.0/#id2489959","What happens when you do this? For reference, your syntax is backwards. It should be &ref1 instead of ref1&, and *ref1 instead of ref1*.","&inventory_hostname_value* setting_of_inventory_hostname: I do not get an error, but I do not see the variables settings_1 and setting_of_inventory_hostname."
tgstation/tgstation,https://github.com/tgstation/tgstation/issues/45191,tgstation_tgstation_issues_45191,"Contractor extractor can take multiple people

if someone is on the tile the extractor lands on, when the target is inserted it takes everyone who was on that tile to the jail. Your tc gain is multiplied by the number of people sent up. @Akrilla 7/15 - It also appears you can drag anyone into the pod to send them. This removes the contract from the contractor's list.",Does this work with monkeymen? Because if so... Hoooooo boy.,7/15 - It also appears you can drag anyone into the pod to send them. This removes the contract from the contractor's list.
tgstation/tgstation,https://github.com/tgstation/tgstation/issues/40379,tgstation_tgstation_issues_40379,"augment programs dont work when triggered at the same time

94213 EDIT: activating more than 1 augment program at the same time causes either only 1 to active or none also having one already actived causes others to not be able to be actived",What do you mean by doesn't work? Do they not activate? Respond to signals? Trigger? Are the programs disappearing?,e same tuseher only 1 to
tgstation/tgstation,https://github.com/tgstation/tgstation/issues/40115,tgstation_tgstation_issues_40115,"Immortality Talisman can be resold over and over again for credits via cargo

Issue reported from a round on a personal server Reporting client version: 512 Related to #39938, with credit to @Poojawa for initially pointing it out. I simply made this issue to get attention to the problem and provide detailed reproduction steps. The Immortality Talisman, due to its coding that prevents its destruction by any known means, cannot be properly sold via Cargo like other Lavaland artifacts. If sold, you will receive credits as normal, but the next time you call back the Cargo shuttle from CentCom, the Immortality Talisman will be on it, right where you left it, and it can be resold again and again, _ad infinitum_. ### Reproduction Steps: 1. Obtain an Immortality Talisman 2. Return the Immortality Talisman to the station proper 3. Use the Cargo Shuttle Console to request the delivery shuttle from CentCom 4. Wait for the delivery shuttle to arrive 5. Place the Immortality Talisman anywhere inside the delivery shuttle 6. Use the Cargo Shuttle Console to send the delivery shuttle back to CentCom 7. **Correct Behavior:** _Upon the delivery shuttle's arrival at CentCom, the Cargo Shuttle Console's CentCom message field will read as follows: ""+x credits: Recieved 1 minor lava planet artifact"" where X is a 4-5 digit number, likely near 10,000. This amount is added to your current Cargo credits._ 8. Use the Cargo Shuttle Console to request the delivery shuttle from CentCom again 9. Wait for the delivery shuttle to arrive 10. **Problem Behavior:** _When the delivery shuttle arrives, the Immortality Talisman you previously sold off to CentCom is still there. You can repeat steps 6 through 10 unlimitedly for infinite credits._ **Here's a screenshot of an example shipment to CentCom:** ![image](https://user-images.githubusercontent.com/27884105/45093307-0523d080-b0e6-11e8-9461-735bef73fe10.png) **Here's what the Cargo Shuttle Console has to say about it after I sent the shipment to them:** ![image](https://user-images.githubusercontent.com/27884105/45093458-6cda1b80-b0e6-11e8-8f3b-04fbb1aeb6bf.png) **When I immediately recalled the Cargo shuttle, this is what came back with it:** ![image](https://user-images.githubusercontent.com/27884105/45093572-ca6e6800-b0e6-11e8-9ac7-5a78cdf63913.png)",Does anything speak against force deleting sold cargo shuttle objs?,an the the the thethe as follows This amount is added to your current Cargo credits.the the the
tgstation/tgstation,https://github.com/tgstation/tgstation/issues/46310,tgstation_tgstation_issues_46310,"Cyborg Hypospray doesnt recharge a chemcial if you use all of that chemical

<!-- Write **BELOW** The Headers and **ABOVE** The comments else it may not be viewable --> ## Round ID:117678 <!--- **INCLUDE THE ROUND ID** If you discovered this issue from playing tgstation hosted servers: [Round ID]: # (It can be found in the Status panel or retrieved from https://atlantaned.space/statbus/round.php ! The round id let's us look up valuable information and logs for the round the bug happened.)--> ## Testmerges:none <!-- If you're certain the issue is to be caused by a test merge [OOC tab -> Show Server Revision], report it in the pull request's comment section rather than on the tracker(If you're unsure you can refer to the issue number by prefixing said number with #. The issue number can be found beside the title after submitting it to the tracker).If no test merges are active, feel free to remove this section. --> ## Reproduction: I use up all 30 units of a chemical in the hypospray and then it doesn't recharge if I use 25 out of the 30 and I still have 5 units, it recharges, but if I don't have 5 units remaining it doesn't. Or to put it simply, no more chemicals in hypo, no recharge in hypo. ##i would like to add that on the status page it says 2500/2500 chemicals <!-- Explain your issue in detail, including the steps to reproduce it. Issues without proper reproduction steps or explanation are open to being ignored/closed by maintainers.--> <!-- **For Admins:** Oddities induced by var-edits and other admin tools are not necessarily bugs. Verify that your issues occur under regular circumstances before reporting them. -->",Does it recharge if you return to a borg charger?,. ##i would like to add that on the status page it says 2500/2500 chemicals
