repo,issue_link,issue_id,post,question,answer
astropy/astroquery,https://github.com/astropy/astroquery/issues/1280,astropy_astroquery_issues_1280,"Possible IRSA dust query bug: inconsistent handling of sky coordinate formats

Firstly, I'm a first time commenter so my apologies if the format of this post isn't right. I'm using astroquery.irsa_dust for my research and am having some problems using get_query_table. I'm trying to open a number of identically-formatted data tables, retrieve the RA and Dec and then query IRSA dust for the extinction data (I'm using get_query_table rather than get_extinction_table as I'm specifically after just the colour excess). The code is shown below: from astroquery.irsa_dust import IrsaDust import astropy.units as u from astropy import coordinates import os from astropy.io import ascii for filename in os.listdir('./Data'): fp = open('./Data/{0}'.format(filename)) for line in fp: if line[0:2] == 'RA': RA = line.split()[1] if line[0:4] == 'DECL': Dec = line.split()[1] break print(RA,Dec) co = coordinates.SkyCoord(ra=RA, dec = Dec, unit=(u.deg,u.deg)) print(co) table = IrsaDust.get_query_table(co,section='ebv') I have a small subset of data in a folder called Initial_Data, and when I use this folder instead the code works perfectly. However, when using the full set of data as in the code above I get the following error: runfile('/home/matt/Documents/Lightcurves/extinction.py', wdir='/home/matt/Documents/Lightcurves') 53.599800 -28.714764 <SkyCoord (ICRS): (ra, dec) in deg (53.5998, -28.714764)> Traceback (most recent call last): File ""<ipython-input-4-449177a18559>"", line 1, in <module> runfile('/home/matt/Documents/Lightcurves/extinction.py', wdir='/home/matt/Documents/Lightcurves') File ""/home/matt/anaconda3/lib/python3.7/site-packages/spyder_kernels/customize/spydercustomize.py"", line 668, in runfile execfile(filename, namespace) File ""/home/matt/anaconda3/lib/python3.7/site-packages/spyder_kernels/customize/spydercustomize.py"", line 108, in execfile exec(compile(f.read(), filename, 'exec'), namespace) File ""/home/matt/Documents/Lightcurves/extinction.py"", line 20, in <module> table = IrsaDust.get_query_table(co,section='ebv') File ""/home/matt/anaconda3/lib/python3.7/site-packages/astroquery/irsa_dust/core.py"", line 299, in get_query_table xml_tree = utils.xml(response.text) File ""/home/matt/anaconda3/lib/python3.7/site-packages/astroquery/irsa_dust/utils.py"", line 119, in xml raise Exception(""The dust service responded with an error: "" + message) Exception: The dust service responded with an error: ERROR: required input [location] is missing. No matter which table I start with, the error always occurs on the first one. I know that RA and Dec are being retrieved correctly and that the coordinates object is being created, so I don't understand why this error occurs. I have checked for a number of different coordinates on the IRSA website and there is data available. I have also tried retrieving the coordinates and inputting them as a string but this still doesn't work. I have also looked at the data set that does work and still notice some irregularities. The code works when defining a coordinates.SkyCoord object as above but putting in the same coordinates as a string gives the same error: In [6]: co Out[6]: <SkyCoord (ICRS): (ra, dec) in deg (34.906941, -6.071715)> In [7]: table = IrsaDust.get_query_table(co,section='ebv') In [8]: table = IrsaDust.get_query_table('2h19m37.67 -6d4m18.17s',section='ebv') /home/matt/anaconda3/lib/python3.7/site-packages/astroquery/utils/commons.py:162: UserWarning: Coordinate string is being interpreted as an ICRS coordinate. warnings.warn(""Coordinate string is being interpreted as an "" Traceback (most recent call last): File ""<ipython-input-8-f8614cacb31e>"", line 1, in <module> table = IrsaDust.get_query_table('2h19m37.67 -6d4m18.17s',section='ebv') File ""/home/matt/anaconda3/lib/python3.7/site-packages/astroquery/irsa_dust/core.py"", line 299, in get_query_table xml_tree = utils.xml(response.text) File ""/home/matt/anaconda3/lib/python3.7/site-packages/astroquery/irsa_dust/utils.py"", line 119, in xml raise Exception(""The dust service responded with an error: "" + message) Exception: The dust service responded with an error: ERROR: required input [location] is missing. Essentially, I have two questions. 1) Why does the first section of code work for one set of table data but not for another set of identically formatted data? 2) Why does one coordinate not work as a string when it works as a SkyCoords object and as a string on the IRSA dust website? I'm not sure if there's something else I could have done wrong or if there's a bug in the code. I've had others look who have more experience and they can't see what's going wrong. Thank you very much for your time, please let me know if there's anything else I can provide that would be helpful.","Could you tell us what version of astroquery, requests, and astropy you're using?","if line[0:4] == 'DECL': Dec = line.split 14764 <SkyCoord (ICRS): (ra, dec) in deg (5.5998, -28.71474)> Traceback (most recent call last): File ""<ipythoninput-4-449177a18559>"", line 1, in <module> runfile('/home/matt/Documents/Lightcurves/extinction.py', wdir='/home/matt/Documents/Lightcurves') File ""/home/matt/anaconda3/lib/python3.7/site-packages/spyder_kernels/customize/spydercustomize.py"", line 668, in runfile execfile(filename, namespace) File ""/home/matt/anaconda3/lib/python3.7/site-packages/spyder_kernels/customize/spydercustomize.py"", line 108, in execfile exec(compile(f.read(), filename, 'exec'), namespace) File ""/home/matt/Documents/Lightcurves/extinction.py"", line 20, in <module> table = IrsaDust.get_query_table(co,section='ebv') File ""/home/matt/anaconda3/lib/python3.7/site-packages/astroquery/irsa_dust/core.py"", line 299, in get_query_table xml_tree = utils.xml(response.text) File ""/home/matt/anaconda3/lib/python3.7/site-packages/astroquery/irsa_dust/utils.py"", line .17s',section='ebv') /home/matt/anaconda3/lib/python3.7/sitepackages/astroquery/utils/commons.py:162: UserWarning: Coordinate string is being interpreted as an ICRS coordinate. warnings.warn(""Coordinate string is being interpreted as an "" Traceback (most recent call last): File ""<ipython-input-8-f8614cacb31e>"", line 1, in <module> table = IrsaDust.get_query_table('2h19m37.67 -6d4m18.17s',section='ebv') File ""/home/matt/anaconda3/lib/python3.7/site-packages/astroquery/irsa_dust/core.py"", line 299, in get_query_table xml_tree = utils.xml(response.text) File ""/home/matt/anaconda3/lib/python3.7/site-packages/astroquery/irsa_dust/utils.py"", line"
ooni/probe,https://github.com/ooni/probe/issues/836,ooni_probe_issues_836,"Get GPS coordinates from the user

This is about adding support for doing a privacy aware geolocation lookup that allows us to gather more precise location information about measurements. The first item that needs to be done is finishing the ticket in ooni/spec on this coming and coming up with a reasonable strategy for doing it: https://github.com/ooni/spec/issues/108.",What's use is this for? Some context?,This is about adding support for doing a privacy aware geolocation lookup that allows us to gather more precise location information about measurements. The first item that needs to be done is finishing the ticket in ooni/spec on this coming and coming up with a reasonable strategy for doing it: https://github.com/ooni/spec/issues/108.
cloudfoundry/uaa,https://github.com/cloudfoundry/uaa/issues/963,cloudfoundry_uaa_issues_963,"Releasing on Maven

### What version of UAA are you running? 4.24.0 ### How are you deploying the UAA? Official Maven WAR from Maven Central #### Issue Can you please explain how the process of releasing on Maven works? Usually a release on Github is not on Maven for a while and there were other issues related to this like; https://github.com/cloudfoundry/uaa/issues/813 Any ETA for 4.28.0 to get to maven, or even 4.29.0 or 4.30.0? Thanks!",Could you share with us how you're using the UAA? We don't have a lot of information about who is consuming UAA from Maven central.,### What version of UAA are you running? 4.24.0 ### ial Maven JAR from Maven Central #### Issue C
mickem/nscp,https://github.com/mickem/nscp/issues/569,mickem_nscp_issues_569,"Memory Leak on Versions >= NSClient++ 0.5.2.35 2018-01-28

### Issue and Steps to Reproduce Upgrade from NSClient++ 0.5.1.31 2017-06-26 to NSClient++ 0.5.2.35 2018-01-28 Still exists in 0.5.2.41 2018-04-26 ### Expected Behavior Memory usage should remain static ### Actual Behavior Memory usage grows over time roughly in correlation with number of checks Unresolved by upgrade to NSClient++ 0.5.2.39 2018-02-04 ### Details * OS and Version: Windows Server 2008, 2008r and 2012 r2 * Checking from: Open Monitoring Distribution running naemon core and gearman * Checking with: check_nrpe, check_nt, check_nsc_web ### Additional Details NSClient++ log: Log is empty ### Graphs Memory leak is demonstrated in graphs here: https://imgur.com/a/APAYxAR In the next week or so, I'll set-up NSClient++ on an additonal box and test different types of checks as to try and narrow down the scope of the issue",When you say an issue in check_nsc_web do you mean a problem when check_nsc_web is used? I.e. there's a memory leak in NSClient's REST API?,Still exists in 0.5.2.41 2018-04-26
hydrogen-music/hydrogen,https://github.com/hydrogen-music/hydrogen/issues/657,hydrogen-music_hydrogen_issues_657,"macOS build for hydrogen 1.0.0-beta1

Hydrogen version : 1.0.0-beta1 - 690a82bbbc979c7676f37fda51af8b346206d465 Operating system + version : macOS Sierra 10.12.6 Audio driver + version : jack 0.125.0_2 - - - - - - - - - - - - - - - - - - - - - - - - - - - - - - - - - - - - - - - - - - - - - - - - - - - - - - - - - For reference, in case it helps others: I've managed to build 1.0.0-beta1 on **macOS Sierra 10.12.6**, using [Homebrew](https://brew.sh) installed dependencies, with the following steps (note: may be incomplete and not all steps necessary):  Then:  At this point failures to compile,  So:  At this point still fails to compile,  So:  Finally this worked:  Hope this helps others. _(note: message edited by @trebmuh for a better display)_ _(note: message edited by @robmckinnon to add missing steps)_",Should we add this (or a link to here) in the [Wiki page for building under macOSX](https://github.com/hydrogen-music/hydrogen/wiki/Building-Hydrogen-from-source-(MAC-OSX)) ? ping @mauser @jeremyz @elpescado,h cp /usr/local/opt/libsndfile/include/sndfile.h ./src/core/include/hydrogen/sndfile.h vi ./src/core/include/hydrogen/basics/sample.h # change include #include <hydrogen/sndfile.h> :wq _(note: message edited by @robmckinnon to add missing steps)_
JimBobSquarePants/ImageProcessor,https://github.com/JimBobSquarePants/ImageProcessor/issues/689,JimBobSquarePants_ImageProcessor_issues_689,"CloudImageService - Image larger when no querystring in set (both png and jpg)

### Description Hi, i'm facing the following issue: **Original image: 97KB** https://macroluxproduction.blob.core.windows.net/catalog/5ae70c760a902e3090234da1/images/800*800-2.jpg **Through ImageProcessingModule: 128KB** http://cdnmacrolux.flyweb.it/media/5ae70c760a902e3090234da1/images/800*800-2.jpg From your source code i found a simple Stream.CopyTo when image has no querystring so should not be processed at all and saved to disk as is. Am I correct? What's even more weird is that all images with original size lower than 128KB grow to exactly 128KB after being processed by the httpmodule; images bigger than 128KB grow to 1.0MB!! Here it's an example: https://macroluxproduction.blob.core.windows.net/catalog/5ae70c760a902e3090234da1/images/800*800.jpg http://cdnmacrolux.flyweb.it/media/5ae70c760a902e3090234da1/images/800*800.jpg ### Steps to Reproduce I can share the project GIT with you if required (on bitbucket) ### System Configuration - ImageProcessor version: 2.6.2.25 - ImageProcessor.Web version: 4.9.3.25 - Other ImageProcessor packages and versions: - Environment (Operating system, version and so on): Windows 10 with VS 15.8.1 (debug), Windows Server 2016 1607 (release) - .NET Framework version: 4.7.2 in both environments - Additional information: processing.config default with interceptAllRequests=""true"" cache.config  security.config",Why did you delete the issue template? How am I supposed to determine what version you are using etc?,### Description dditional information: processing.config default with interceptA
gemrb/gemrb,https://github.com/gemrb/gemrb/issues/120,gemrb_gemrb_issues_120,"[bug] As soon as save game loads NPCs react to reputation

**Describe the bug** As soon as save game loads NPCs react to reputation ![Rep_reaction_triggers](https://user-images.githubusercontent.com/17316115/54134016-8d649480-43ed-11e9-9be1-03ff57fd2735.jpg) TODO: check if UpdateHappiness or anything related is called too early for the timers etc to be defined.",how does your happy.2da look?,TODO: check if UpdateHappiness or anything related is called too early for the timers etc to be defined.
gemrb/gemrb,https://github.com/gemrb/gemrb/issues/143,gemrb_gemrb_issues_143,"[bug] Malus XP Bonus (104) don't reduce the actor's XP.

Malus XP Bonus (104) will not reduce party NPC experience. Quickest way of reproducing the bug is to have NTotSC installed. Summon the items in the console: NTMISC08 and NTSWD05. Go to the area AR10PB. Open the tomb in the north eastern part of the map. When you enter the tomb with the sword NTSWD05 after dialog with General Ghotal your party will receive the bonus XP malus (-5000). The XP malus is done via spell in the area script AR11PB.BCS. ApplySpellRES(""NTSWD5XP"",Player8)  ![XP MALUS](https://user-images.githubusercontent.com/17316115/56991697-4c277000-6b66-11e9-8cfe-b8fe2bd7ec0a.jpg) <details><summary>Area script AR11PB.BCS</summary>  </details>",What happens instead?,<details><summary>Area script AR11PB.BCS</summary>  </details>
notepadqq/notepadqq,https://github.com/notepadqq/notepadqq/issues/827,notepadqq_notepadqq_issues_827,"cannot open a file in the root directory that starts with _ or . or even symlinks to anything in root

**Describe the bug** cannot open a file in a root directory that starts with _ (eg: /_a/file.txt) cannot even select the dir also applies to a root directory that starts with . (eg: /.a/file.txt) **To Reproduce** Make a dir in root that starts with _ or . **Expected behavior** Browse dir and open, edit, save file **Environment (please complete the following information):** - Ubuntu 18.04 - Installation type snap [classic] - Qt version 5.5.1 - Notepadqq version 1.4.8 **Additional context** also fails with ""notepadqq /_a/file.xyz"" (opens an empty file in an unknown location)",Maybe that's what you've been seeing? I don't know why a directory starting with _ would not show up.,root (eg: /_a/file.txt)also applies to a root directory that starts with . (eg: /.a/file.txt) [classic]
shelljs/shelljs,https://github.com/shelljs/shelljs/issues/942,shelljs_shelljs_issues_942,"shell.exec('bash') don't work on debian 9 konsole

<!-- Before posting your issue, please check our FAQ: https://github.com/shelljs/shelljs/wiki/FAQ --> ### Node version (v10.16.0): ### ShellJS version (0.8.3): ### Operating system: (Debian 9) ### Description of the bug: I am changing my shell using .exec('bash'), but system is getting hanged and not executing that command through shellJS, whereas when I normally type bash in my console, it works fine. ### Example ShellJS command to reproduce the error:",Can you include the error output too? Could you also show the output of:,"shell using .exec('ash'), but s//"
alerta/alerta,https://github.com/alerta/alerta/issues/959,alerta_alerta_issues_959,"Error: update only works with $ operators

**Issue Summary** When trying to close an alert, either through the UI or with the alerta cli, I'm getting the error message Error: update only works with $ operators.  That started a couple of days ago and wasn't the case before I went to 7.0 - any idea what could be causing this? **Environment** - OS: Linux - API version: 7.1.0 for the server and 6.8.1 for the CLI - Deployment: self-hosted - For self-hosted, WSGI environment: nginx/uwsgi - Database: MongoDB v4.0.9 - Server config: Auth enabled? Yes/No Auth provider? Google, GitHub, OpenID, Basic, LDAP, etc Customer views? Yes/No (or provide the /config endpoint output) - web UI version: [eg. 6.8.1] - CLI version: [eg. 6.8.1] **To Reproduce** Tried 3 different ways: 1. in the UI opening an alert and then clicking the x-symbol to close that alert. Shows the error message as a red fly-in at the bottom of the page for a second 2. in the UI in the alert list selecting multiple alerts and clicking the x-symbol as well, gettting the same error message for a little while at the bottom of the page 3. in the console using alerta close --all responds with the error message from the subject line just once and stoping the alerta client. For web app issues, include any web browser JavaScript console errors. **Expected behavior** A clear and concise description of what you expected to happen. **Web console errors**  **Additional context** I currently have 10 open alerts and none of them can be closed (or used any other action). But I also just had one which I was able to close. It happens with close, ack and shelve, but the watch action does work.",Can you get the full error from the network tab of the web browser JavaScript console?, That started a couple of days ago and wasn't the case before I went to 7.0 - any idea what could be causing this?in the alert list selecting multiple alerts and clicking the x-symbol as
linux-test-project/ltp,https://github.com/linux-test-project/ltp/issues/572,linux-test-project_ltp_issues_572,"sync_file_range02 failed

Hi, I've got the following failed message when running case sync_file_range02: sync_file_range02.c:74: FAIL: Sync inside of write: Synced 22282240, expected 16777216 sync_file_range02.c:74: FAIL: Sync overlaps with write: Synced 9699328, expected 8388608 Before commit b928910ca769 ""syscalls/sync_file_range: add partial file sync test-cases"", the case is PASS. I've noticed that this commit has changed the PASS condition: Before: written >= FILE_SIZE After: (written >= tc->exp_sync_size) && (written <= (tc->exp_sync_size + tc->exp_sync_size/10)) I'm not sure why we set a threshold 10%. And I think it has missed some scenarios. My kernel is 4.19.67, using ext4, and this issue can only be found in debug kernel.",Can you include some details here? Such as distribution/kernel version the test output when it failed etc. We can hardly do anything without this information.,"Hi, I've got the following failed message when running case sync_file_range02: sync_file_range02.c:74: FAIL: Sync inside of write: Synced 22282240, expected 16777216 sync_file_range02.c:74: FAIL: Sync overlaps with write: Synced 9699328, expected 8388608 Before commit b928910ca769 ""syscalls/sync_file_range: add partial file sync test-cases"", the case is PASS. I've noticed that this commit has changed the PASS condition: Before: written >= FILE_SIZE After: (written >= tc->exp_sync_size) && (written <= (tc->exp_sync_size + tc->exp_sync_size/10)) I'm not sure why we set a threshold 10%. And I think it has missed some scenarios. My kernel is 4.19.67, and this issue can only be found in debug kernel."
bitdump/BLHeli,https://github.com/bitdump/BLHeli/issues/315,bitdump_BLHeli_issues_315,"REQUEST: change increments of Maximum Acceleration

would it be possible to change the increments of maximum acceleration from 0.1 to 0.2 or even 0.4? Explanation: i fly 6s rigs with stronge and higher KV motors. I experienced sync losses on various blheli32 4in1‘s for which i found the only remedy was using max acceleration. everything else failed (demag compensation, higher/lower or auto motor timing, higher/lower startup power etc. - I tried them all in hours and hours of tedious testing) i would like to dial in the setting of max acceleration to a point just short of getting these sync losses. with the highest setting around 25%, my quad flies fine - but i believe there would still be some headroom the increase it even more. i wonder if it would still fly fine with 30% , 40% or even higher. with a bigger increment of the parameter we would be able to set it to higher values - i guess an increment of 0.2 still allows for a enough fine grained adjustment. kind regards, mickeydee EDIT: blheli32 versions tested: 32.4 / 32.43 motors: brotherhobby r5 2306 2450KV / brotherhobby returner R6 2207 2400KV / t-motor f40 pro II 2400KV esc‘s: typhoon32 v2 / bolt32 / hglrc dinoshot 60a / x-racer quadrant 35a",Did you try setting a current limit to avoid sync loss?,don various blheli32 4in1‘s .believe there would still be some headroom the increase it even more. i EDIT: blheli32 versions tested: 32.4 / 32.43 motors: brotherhobby r5 2306 2450KV / brotherhobby returner R6 2207 2400KV / t-motor f40 pro II 2400KV esc‘s: typhoon32 v2 / bolt32 / hglrc dinoshot 60a / x-racer quadrant 35a
seblucas/cops,https://github.com/seblucas/cops/issues/399,seblucas_cops_issues_399,"/vendor/autoload.php missing ?

I'm getting this error on apache logs [Thu Jun 28 2018] [:error] [pid 3342] [client] PHP Warning: require_once(/var/www/html/sex.com/public_html/vendor/autoload.php): failed to open stream: No such file or directory in /var/www/html/sex.com/public_html/config.php on line 9",Can you be a little more specific ?,I'm getting this error on apache logs [Thu Jun 28 2018] [:error] [pid 3342] [client] PHP Warning: require_once(/var/www/html/sex.com/public_html/vendor/autoload.php): failed to open stream: No such file or directory in /var/www/html/sex.com/public_html/config.php on line 9
juce-framework/JUCE,https://github.com/juce-framework/JUCE/issues/566,juce-framework_JUCE_issues_566,"[Feature request] Projucer: ""Add new folder""

If I want to create a new folder in the source tree of my Projucer project and have that folder mapped to a Projucer group, that workflow is currently quite painful: - Projucer: Find a file - Projucer: Right click -> Reveal in Finder - Finder: Create Folder in filesystem - Projucer: Right click -> Add Existing files... -> select folder It would be really useful if a new item could be added to the right-click context menu ""Add new folder"", which creates a folder at the relevant point in the hierarchy and maps it to a Projucer group.","How would this differ to the ""Add New Group"" menu option in the file tree?","If I want to create a new folder in the source tree of my ht-click context menu ""Add new folder"""
find-sec-bugs/find-sec-bugs,https://github.com/find-sec-bugs/find-sec-bugs/issues/525,find-sec-bugs_find-sec-bugs_issues_525,"Incompatibility with SpotBugs 4.0.0

## Environment Gradle 5.6.2, Java 12, SpotBugs 4.0.0-beta4, FindSecBugs 1.10.0. Running SpotBugs via Gradle causes a million errors like this one:",Can you provide the full stacktrace? This runtime exception will encapsulate the cause of the error. https://github.com/find-sec-bugs/find-sec-bugs/blob/master/findsecbugs-plugin/src/main/java/com/h3xstream/findsecbugs/taintanalysis/TaintFrameModelingVisitor.java#L594-L600,At java.base/jdk.internal.reflect.NativeMethodAccessorImpl.invoke0(Native Method) At java.base/jdk.internal.reflect.NativeMethodAccessorImpl.invoke(NativeMethodAccessorImpl.java:62) At java.base/jdk.internal.reflect.DelegatingMethodAccessorImpl.invoke(DelegatingMethodAccessorImpl.java:43) At java.base/java.lang.reflect.Method.invoke(Method.java:567) At org.gradle.internal.dispatch.ReflectionDispatch.dispatch(ReflectionDispatch.java:36) At org.gradle.internal.dispatch.ReflectionDispatch.dispatch(ReflectionDispatch.java:24) At org.gradle.internal.remote.internal.hub.MessageHubBackedObjectConnection$DispatchWrapper.dispatch(MessageHubBackedObjectConnection.java:182) At org.gradle.internal.remote.internal.hub.MessageHubBackedObjectConnection$DispatchWrapper.dispatch(MessageHubBackedObjectConnection.java:164) At org.gradle.internal.remote.internal.hub.MessageHub$Handler.run(MessageHub.java:412) At org.gradle.internal.concurrent.ExecutorPolicy$CatchAndRecordFailures.onExecute(ExecutorPolicy.java:64) At org.gradle.internal.concurrent.ManagedExecutorImpl$1.run(ManagedExecutorImpl.java:48) At java.base/java.util.concurrent.ThreadPoolExecutor.runWorker(ThreadPoolExecutor.java:1128) At java.base/java.util.concurrent.ThreadPoolExecutor$Worker.run(ThreadPoolExecutor.java:628) At org.gradle.internal.concurrent.ThreadFactoryImpl$ManagedThreadRunnable.run(ThreadFactoryImpl.java:56) At java.base/java.lang.Thread.run(Thread.java:835)
gomodule/redigo,https://github.com/gomodule/redigo/issues/424,gomodule_redigo_issues_424,"ScanStruct and nested struct

If there is a structure inside the structure, the fields after the nested structure are not scanned correctly. The fix is to check the field kind(), skip nested structure conversion, and return nil. This issue has been resolved with the redis:""-"" tag feature.",Do you have an example of this issue?,"This issue has been resolved with the redis:""-"" tag feature."
