repo,issue_link,issue_id,post,question,answer
mpv-player/mpv,https://github.com/mpv-player/mpv/issues/7607,mpv-player_mpv_issues_7607,"Color clipping in high brightness content with HDR output

### Important Information - mpv version: mpv-x86_64-20200405-git-c5f8ec7 (shinchiro) - Windows Version: Windows 10 Pro, 1909, 18363.752 ### Reproduction steps First, the output display needs to support HDR. Windows HDR is not enabled, mpv triggers HDR when set into fullscreen. Config: If it's of any use, removing target-peak=700 still exhibits the same issue but it's not clipping as much. ### Expected behavior The orange color on the mountain's peak should be desaturated to show the details. ### Actual behavior The orange color looks like it's clipping and looks ""flat"" instead of showing the actual details in the video stream. There is also haloing around the mountain. Not pretty but this is a close up on my TV, an LG OLED C8. https://imgbox.com/MJt0r7tQ ### Log file https://0x0.st/iSGO.txt ### Sample files https://0x0.st/iSGe.mkv","What about when you have no tone mapping added? In other words, just the CSP set.","### Reproduction steps First, the output display needs to support HDR. Windows HDR is not enabled, mpv triggers HDR when set into fullscreen. Config: If it's of any use, removing target-peak=700 still exhibits the same issue but it's not clipping as much. ### Expected behavior The orange color on the mountain's peak should be desaturated to show the details. ### Actual behavior The orange color looks like it's clipping and looks ""flat"" instead of showing the actual details in the video stream. There is also haloing around the mountain."
RIOT-OS/RIOT,https://github.com/RIOT-OS/RIOT/issues/10057,RIOT-OS_RIOT_issues_10057,"RFC: Further GitHub labeling improvements

### Description This issue follows on from https://github.com/RIOT-OS/RIOT/issues/10030. That issue deals only with re-naming current labels, but during the discussion, a number of further points of action are being brought up. These will be captured below. Feel free to add more points yourself (but preferably not delete). ### Further labeling actions: - [ ] Add further labels proposed during that discussion. A couple of suggestions: - State: under review - State: inactive - State: blocked - Priority: {high|low|medium} - Review requirement: light - Review requirement: thorough - Type: security flaw - [ ] Issue triaging: sorting and re-labelling issues - [ ] Extracting useful information for the CI (show warning if there's a new feature with no test, not test everything if there's only a change in documentation, etc). - [ ] Automated label-setting",Do the State: xxxxxxx labels are automatically set by some kind of scripts or should they be set by maintainers ?,- [ ] Automated label-setting
quilljs/quill,https://github.com/quilljs/quill/issues/2548,quilljs_quill_issues_2548,"Clearing specific quill fields using a button

I am fairly new to Quilljs. So, please bare with me as I attempt to describe my needs. I am using Quilljs 1.3.6. I want to add a button on an HTML form that will clear specific quilljs fields. If I use jquery on any non-quilljs field, all I have to do is create a button that calls a javascript function, that deletes the field(s). For example: <b>HTML</b> &lt;label for=""strengths""&gt;How strong are you?&lt;label&gt; &lt;input type='text' name='strengths' id='strengths'&gt; &lt;input type=""button"" onclick=""clearTextField()""&gt;Clear Field&lt;/button&gt; <b>Javascript File</b> function clearTextField() { $('#strengths').val(''); } How do I clear a quilljs field? I would like to do something like this: <b>HTML</b> &lt;label for=""strengths""&gt;How strong are you?&lt;label&gt; &lt;input type=""hidden"" name=""strengths""&gt; &lt;div id=""strengths-container""&gt; &lt;p&gt;Blah Blah Blah&lt;/p&gt; &lt;/div&gt; &lt;input type=""button"" onclick=""clearTextField()""&gt;Clear Field&lt;/button&gt; <b>Javascript File</b> function clearTextField() { strengths.setContents([]); } However, this won't work, because: var strengths = new Quill(""#strengths-container"", { modules: { toolbar: toolbaroptions }, theme: ""snow"" }); function clearTextField() { $('#strengths').val(''); } was created in a different function. So, the scope of the object is limited to the that function. Is there a way clear the contents of a field with quilljs, separate from the function that instantiated the object?","What do you mean by a field? Quill have full control of the DOM and expose an API to update the [contents](https://quilljs.com/docs/api/#content) and [formats](https://quilljs.com/docs/api/#formatting), you shouldn't access it directly.","label for=""strengths""&lt;How strong are you?&gt; &lt;<b>HTML</b> &lt;label for=""strengths""&lt;How strong are you?&gt; &lt;div id=""strengths-container""&gt; &lt;p&gt;Blah Blah Blah&lt;/p&gt; &lt;/div&gt; &lt;input type=""button"" onclick=""clearTextField()""&gt;Clear Field&lt;/button&gt; &lt;b&gt;Javascript File&lt;/b&gt;"
gravitystorm/openstreetmap-carto,https://github.com/gravitystorm/openstreetmap-carto/issues/3514,gravitystorm_openstreetmap-carto_issues_3514,"highway=service + living_street=yes paint over as highway=living_street

### Expected behavior highway=service + living_street=yes paint over as highway=living_street Added: change only the color, but not the width ### Actual behavior highway=service + living_street=yes paint over as highway=residential ### Links and screenshots illustrating the problem https://taginfo.openstreetmap.org/tags/living_street=yes#combinations",Could you show the location (link) where the problem is visible and possibly post an image showing it?,"Added: change only the color, but not the width"
gravitystorm/openstreetmap-carto,https://github.com/gravitystorm/openstreetmap-carto/issues/3298,gravitystorm_openstreetmap-carto_issues_3298,"Good first issues [meta-ticket]

### Regularly updated task list: **single icons:** - [x] amenity=boat_rental https://github.com/gravitystorm/openstreetmap-carto/issues/3263 -> done! https://github.com/gravitystorm/openstreetmap-carto/pull/3300 - [x] amenity=bureau_de_change https://github.com/gravitystorm/openstreetmap-carto/issues/3185 -> done! https://github.com/gravitystorm/openstreetmap-carto/pull/3301 - [x] shop=charity; second_hand https://github.com/gravitystorm/openstreetmap-carto/issues/1869 -> done! https://github.com/gravitystorm/openstreetmap-carto/pull/3302 - [x] shop=interior_decoration https://github.com/gravitystorm/openstreetmap-carto/issues/1406 -> done! https://github.com/gravitystorm/openstreetmap-carto/pull/3293 - [x] shop=video https://github.com/gravitystorm/openstreetmap-carto/issues/3116 -> done! https://github.com/gravitystorm/openstreetmap-carto/pull/3313 - [x] leisure=bowling_alley https://github.com/gravitystorm/openstreetmap-carto/issues/3297 -> done! https://github.com/gravitystorm/openstreetmap-carto/pull/3311 - [x] shop=paint https://github.com/gravitystorm/openstreetmap-carto/issues/3288 -> done! https://github.com/gravitystorm/openstreetmap-carto/pull/3323 - [x] shop=massage https://github.com/gravitystorm/openstreetmap-carto/issues/3287 -> done! https://github.com/gravitystorm/openstreetmap-carto/pull/3309 - [x] leisure=outdoor_seating https://github.com/gravitystorm/openstreetmap-carto/issues/3241 -> done! https://github.com/gravitystorm/openstreetmap-carto/pull/3328 - [x] leisure=bird_hide https://github.com/gravitystorm/openstreetmap-carto/issues/3175 -> done! https://github.com/gravitystorm/openstreetmap-carto/pull/3340 - [x] shop=bookmaker https://github.com/gravitystorm/openstreetmap-carto/issues/3186 -> done! https://github.com/gravitystorm/openstreetmap-carto/pull/3345 - [x] shop=trade https://github.com/gravitystorm/openstreetmap-carto/issues/3291 -> done! https://github.com/gravitystorm/openstreetmap-carto/pull/3361 - [x] man_made=storage_tank/ silo https://github.com/gravitystorm/openstreetmap-carto/issues/588 https://github.com/gravitystorm/openstreetmap-carto/issues/2909 -> done! https://github.com/gravitystorm/openstreetmap-carto/pull/3384 - [x] orthodox cross ~~https://github.com/gravitystorm/openstreetmap-carto/issues/1186~~ -> closed - [x] leisure=amusement_arcade https://github.com/gravitystorm/openstreetmap-carto/issues/3371 -> done! https://github.com/gravitystorm/openstreetmap-carto/pull/3375 - [x] amenity=bicycle_repair_station https://github.com/gravitystorm/openstreetmap-carto/issues/3069 -> done! https://github.com/gravitystorm/openstreetmap-carto/pull/3391 - [x] tourism=gallery https://github.com/gravitystorm/openstreetmap-carto/issues/883 -> done! https://github.com/gravitystorm/openstreetmap-carto/pull/3401 - [x] amenity=vehicle_inspection https://github.com/gravitystorm/openstreetmap-carto/issues/3378 -> done! https://github.com/gravitystorm/openstreetmap-carto/pull/3434 - [x] amenity=internet_cafe https://github.com/gravitystorm/openstreetmap-carto/issues/3451 -> done! https://github.com/gravitystorm/openstreetmap-carto/pull/3463 - [x] man_made=telescope https://github.com/gravitystorm/openstreetmap-carto/issues/3389 -> done! https://github.com/gravitystorm/openstreetmap-carto/pull/3473 - [x] amenity=public_bookcase https://github.com/gravitystorm/openstreetmap-carto/issues/1288 -> done! https://github.com/gravitystorm/openstreetmap-carto/pull/3462 - [x] leisure=fishing https://github.com/gravitystorm/openstreetmap-carto/issues/3390 -> done! https://github.com/gravitystorm/openstreetmap-carto/pull/3508 - [x] shop=fabric/ carpet/ sewing https://github.com/gravitystorm/openstreetmap-carto/issues/3289 -> done! https://github.com/gravitystorm/openstreetmap-carto/pull/3555 **sets of icons:** - [x] memorials https://github.com/gravitystorm/openstreetmap-carto/issues/3088 -> done! https://github.com/gravitystorm/openstreetmap-carto/pull/3356 - [x] healthcare objects https://github.com/gravitystorm/openstreetmap-carto/issues/2938 -> done! https://github.com/gravitystorm/openstreetmap-carto/pull/3498 - [x] crane https://github.com/gravitystorm/openstreetmap-carto/issues/3478 -> done! https://github.com/gravitystorm/openstreetmap-carto/pull/3501 -> cranes ~~https://github.com/gravitystorm/openstreetmap-carto/issues/3573~~ -> closed :(",Where could I start?,- [x] shop=charity; second_hand https://github.com/gravitystorm/openstreetmap-carto/issues/1869 -> done! https://github.com/gravitystorm/openstreetmap-carto/pull/3302
flyway/flyway,https://github.com/flyway/flyway/issues/2206,flyway_flyway_issues_2206,"MariaDB: Can't create database 'null' error if no database was specified in URL

###### Which version and edition of Flyway are you using? Flyway Community Edition 5.2.1 by Boxfuse (also happens with 5.1.4) ###### Which client are you using? (Command-line, Java API, Maven plugin, Gradle plugin) CLI ###### Which database are you using (type & version)? mysql Ver 15.1 Distrib 10.1.34-MariaDB, for debian-linux-gnu (x86_64) using readline 5.2 ###### Which operating system are you using? ubuntu 18.10 (also happens on arch linux) ###### What did you do? Use flyways multi-schema support ###### What did you expect to see? Having flyway create the schema table to hold flyway_schema_history ###### What did you see instead? Working call that created the schema for flyway_schema_history  Failed call that doesn't create the schema and directly fails at the flyway_schema_history table  Please note the timing difference and the missing Creating schema [..] ...",What does the debug output (-X) look like?,(also happens with 5.1.4) (also happens on arch linux)
flyway/flyway,https://github.com/flyway/flyway/issues/2327,flyway_flyway_issues_2327,"MariaDB Cluster

###### Which version and edition of Flyway are you using? 4.1 and 5.2 ###### If this is not the latest version, can you reproduce the issue with the latest one as well? Yes. ###### Which client are you using? (Command-line, Java API, Maven plugin, Gradle plugin) Command-line. ###### Which database are you using (type & version)? MariaDB Cluster 10.2, 10.3, 10.4. ###### Which operating system are you using? CentOS 7.5 ###### What did you do? Simple migration from test. ###### What did you expect to see? No locks. ###### What did you see instead? This is a similar issue to #1556. MariaDB is not the same as MariaDB cluster, in that functions like GET_LOCK() are not supported, and bring a cluster to it's knees and blocks all writes. Could we please have a configuration similar to Percona XtraDB cluster which uses the MariaDB Connector/J?","Which version of Flyway are you using? Which version of MariaDB, exact error message, steps to reproduce, ...","###### Which version and edition of Flyway are you using? 4.1 and 5.2 ###### If this is not the latest version, can you reproduce the issue with the latest one as well? Yes. ###### Which client are you using? (Command-line, Java are not supported, and bring a cluster to it's knees and blocks all writes. Could we please"
flyway/flyway,https://github.com/flyway/flyway/issues/2755,flyway_flyway_issues_2755,"Flyway support SAP Hana .hdbview files

###### Which version and edition of Flyway are you using? flyway-6.3.2 ###### If this is not the latest version, can you reproduce the issue with the latest one as well? (Many bugs are fixed in newer releases and upgrading will often resolve the issue) I believe above mentioned version latest ###### Which client are you using? (Command-line, Java API, Maven plugin, Gradle plugin) Command-line ###### Which database are you using (type & version)? HDB2.0 ###### Which operating system are you using? Mac Os ###### What did you do? schema = ""CORE_P08""; query = "" select * \""CORE_P08\"".\""CORE_P08.SCRIPT::TDF_TEMPLATE()\"" "" ; ###### What did you expect to see? After migration repository object should be shown as Sql Scripted View .Hdbview ext in SAP HANA ###### What did you see instead? Not a regular Sql Standard","Would you be able to provide the script you tried to run that failed, as well as the error message you got?",Not a regular Sql Standard
flyway/flyway,https://github.com/flyway/flyway/issues/2766,flyway_flyway_issues_2766,"ERROR: Unable to calculate checksum of <<inputfile.sql>> 4/9/2020 4:11:38 PMInput length = 1

###### Which version and edition of Flyway are you using? Flyway 6.3.3 ###### If this is not the latest version, can you reproduce the issue with the latest one as well(Many bugs are fixed in newer releases and upgrading will often resolve the issue) This issue was not there in 4.2.0 but when we tried to upgrade to 6.2.2 this issue appeared. Upgraded with the latest version i.e. 6.3.3 but the issue still persists ###### Which client are you using? (Command-line, Java API, Maven plugin, Gradle plugin) Command-line ###### Which database are you using (type & version)? PostgreSQL 11.6 ###### Which operating system are you using? RHEL 7.5 ###### What did you do? Upgraded the docker image which has flyway bundle as the migration tool. Image is having SQL files which are checked in by our engineering team members. They uses different types of editor such as pgadmin,dbeaver,notepad++ All was good in 4.2.0 until we decided to upgrade to 6.2.2 to fix a security issue which popped up due to 2 of the DB drivers present in the flyway db. Once we upgraded, the security issue was resolved as the 6.2.2 version of flyway was using latest versions of the drivers but we started facing this ""unable to calculate checksum"" issue. Then we had to downgrade it back to 4.2.0 and decided to remove the drivers from the pack which were causing the security issues. Removal of the drivers from the image solved the problem but we want to upgrade the flyway now so that we don't have to remove the drivers ###### What did you expect to see? The expectation is that this issue should not pop up as we can't go and correct the type conversion to UTF-8 for each and every file. For lot of files used for different engines and modules we are facing this. Even we tried to convert one problematic file to UTF-8 in notepad++ but we were still receiving the same error. We have lot of SQL files checked in for last few years and now they have grown up so much that we can't go and correct each of them or ask our engineers to correct them and also we don't even know how the file changes will impact the upgrade process in customer environments using our product and also as I said we are not sure also that the issue will be resolved post the changes of UTF-8 conversion. Any configuration tweak may also help if there is a way so that this error can be bypassed. ###### What did you see instead? The expectation is that the issue should not pop up and the latest version of flyway and it should behave like 4.2.0 so that we can upgrade the latest flyway db in our database image",Can you share the file that is causing the issue?,when we but membersthat or ask our engineers to correct them and also we don't even know how the file changes will impact the upgrade process in customer environments using our productand it d
AntennaPod/AntennaPod,https://github.com/AntennaPod/AntennaPod/issues/3635,AntennaPod_AntennaPod_issues_3635,"Apostrophes are rendered as HTML-Code &#39;

App version: 1.7.3b from PlayStore Android version: 9 Device model: Samsung Galaxy S10 Expected behaviour: Show apostrophes Current behaviour: Renders apostrophes as &#39; First occured: Today in the current version Steps to reproduce: Subscripe a klingon podcast or something else with an apostrophe in the title or description Environment: Nothing special Link to the Podcast: http://pebil.castos.com/ ![Screenshot_20191122-084314_AntennaPod](https://user-images.githubusercontent.com/11636441/69414154-7911bf00-0d12-11ea-803d-46baaac3dd91.jpg) ![Screenshot_20191122-101818_AntennaPod](https://user-images.githubusercontent.com/11636441/69414155-79aa5580-0d12-11ea-9263-c5752705d71e.jpg)",Could you please share the url for that podcast?,Link to the Podcast: http://pebil.castos.com/
edenhill/librdkafka,https://github.com/edenhill/librdkafka/issues/1858,edenhill_librdkafka_issues_1858,"High CPU Usage caused by librdkafka

Description - updated =========== The dump file shows 15 threads, 4 of them shows very long CPU time. I am posting the call stacks of the 4 threads here, if you like, you can also open the attached file. The symptom is similar to this issue but it should have been fixed: https://github.com/edenhill/librdkafka/issues/1569 And I really see the Kafka brokers are down and up at the time this issue happened, but I am unable to reproduce this. Dump file info, I got this by running ~*k command in windbg: ...  How to reproduce ================ Unfortunately I cannot reproduce this issue. When this issue happened, we have about 40K consumers and 10K producers connected to 10 Kafka Brokers. **IMPORTANT**: Always try to reproduce the issue on the latest released version (see https://github.com/edenhill/librdkafka/releases), if it can't be reproduced on the latest version the issue has been fixed. Checklist ========= **IMPORTANT**: We will close issues where the checklist has not been completed. Please provide the following information: - [x] librdkafka version (release number or git tag): 0.11.5 - [ ] Apache Kafka version: 0.10.0 - [ ] librdkafka client configuration: Default librdkafka settings. - [ ] Operating system: Windows 10 64bit",What exact librdkafka version were you using (v0.11.5 is not released yet so that's not a thing)? Did you use one of the librdkafka.redist packages?,10 Id: 2780.2cac Suspend: 0 Teb: 0000003dad520000 Unfrozen # Child-SP RetAddr Call Site 00 (Inline Function) ---------------- librdkafka!rd_clock+0x364 librdkafka!_thrd_wrapper_function+0x1b [e:\src\one\oss\librdkafka\src\tinycthread7] 05 0000003dae7ffda0 00007ffedrapper_function1b [e:\src\one\oss\librdkafka\src\tinycthread.c @ 6
NLog/NLog,https://github.com/NLog/NLog/issues/2823,NLog_NLog_issues_2823,"Installing NLog.Config and NLog.Schema in a .NET Core project in Visual Studio 15.7.x and/or NuGet 4.7.x does not copy the files in the project root

**Update:** The issue seems to be tied to the version of Visual Studio and/or NuGet too, see [below](https://github.com/NLog/NLog/issues/2823#issuecomment-410200808). # How to reproduce the problem Add the NLog, NLog.Config and NLog.Schema packages to a .NET Core 2.1 Console Application project. # Expected behaviour The XML and XSD files from NLog.Config and NLog.Schema are copied in the project root. # Actual behaviour The files are not copied to the project root, instead they are somehow ""virtually linked"" there (there's no ""link"" at file system level) from the NuGet packages cache directories. # Why this is a problem 1. The content of the files are shared between all projects using the packages: if I modify the XML in project A, project B will see the same changes since the physical file is the same. 1. If the XML and the XSD are not besides each other, IntelliSense will not pick up the schema and won't provide any autocompletion. The first problem is especially nasty since it affects every projects that is using the packages, and there's absolutely no warning about it. # Related issues #2461, #2686, #2757 Maybe related to https://docs.microsoft.com/en-us/nuget/reference/migrate-packages-config-to-package-reference#package-compatibility-issues as suggested in #2757. # Platforms - Visual Studio: Microsoft Visual Studio Professional 2017 Version 15.7.5 - ReSharper: JetBrains ReSharper Ultimate 2018.1.3 Build 112.0.20180626.160528 - Framework: .NET Core 2.1 - Target framework: netcoreapp2.1 - Project type: Console application - Project SDK: Microsoft.NET.Sdk # Packages versions - NLog: 4.5.7 - NLog.Config: 4.5.7 - NLog.Schema: 4.5.7 # Screenshots Installing the packages adds ""virtual files"": ![image](https://user-images.githubusercontent.com/1249988/43454512-98e709b2-94bd-11e8-8af9-bdf8e8d7049e.png) The files are ""linked"" from the NuGet packages cache: ![image](https://user-images.githubusercontent.com/1249988/43454565-c799ad3c-94bd-11e8-86bf-7967dc9e084f.png) The packages have been added through PackageReference: ![image](https://user-images.githubusercontent.com/1249988/43454597-db6bccc8-94bd-11e8-8212-ca61aadfe3e2.png) The files are not copied in the project root: ![image](https://user-images.githubusercontent.com/1249988/43454932-b78f7a42-94be-11e8-9770-cbba52dc47ae.png) IntelliSense will not pick up the XSD schema, and the XML file is shared between every project: ![image](https://user-images.githubusercontent.com/1249988/43455268-a1da36d2-94bf-11e8-88d0-6b22c9f9de05.png) (The XML file in the screenshot has not been yet modified _in this project_, yet its content is not the default one but the modified one from another project.)",Does anyone has an idea what needs to be changed in the nuspec to get this working?,"**Update:** The issue seems to be tied to the version of Visual Studio and/or NuGet too, see [below](https://github.com/NLog/NLog/issues/2823#issuecomment-410200808)."
OpenSlides/OpenSlides,https://github.com/OpenSlides/OpenSlides/issues/4053,OpenSlides_OpenSlides_issues_4053,".htaccess proxy not working

I am trying to set up OpenSlides on my all-inkl.com shared webspace hosting. They support Python 3.5 and everything works quite fine. The only Problem I have is when opening the page using my browsers. I get the login prompt and as soon as I enter valid credentials (admin-admin) I geht the attached blank page: ![screenshot_2018-12-07 startseite openslides](https://user-images.githubusercontent.com/29579394/49662297-b0c51f80-fa4b-11e8-8d6e-3ef9b282d969.png) I can see on the console that my computer tries to fetch different pages and always uses alternating ports: [2018/12/07 18:14:09] HTTP GET /ws/site/ 200 [0.02, 127.0.0.1:48388] [2018/12/07 18:14:14] HTTP GET /users/whoami 301 [0.03, 127.0.0.1:48400] [2018/12/07 18:14:14] HTTP GET /users/whoami/ 200 [0.06, 127.0.0.1:48402] [2018/12/07 18:14:14] HTTP GET /ws/site/ 200 [0.04, 127.0.0.1:48404] [2018/12/07 18:14:20] HTTP GET /users/whoami/ 200 [0.07, 127.0.0.1:48416] [2018/12/07 18:14:21] HTTP GET /ws/site/ 200 [0.02, 127.0.0.1:48418] [2018/12/07 18:14:26] HTTP GET /users/whoami/ 200 [0.13, 127.0.0.1:48428] [2018/12/07 18:14:26] HTTP GET /ws/site/ 200 [0.03, 127.0.0.1:48430] This is my .htaccess file: RewriteEngine On  RewriteRule (.*) http://localhost:8000/$1 [L,P] Do you have an idea why this doesn't work? I think it might be an issue. EDIT: Made output prettier","Can you access it manually on port 8000? If so, there might be something wrong with your proxy settings.",EDIT: Made output prettier
hapijs/joi,https://github.com/hapijs/joi/issues/1565,hapijs_joi_issues_1565,"stripUnknown not stripping unwanted keys

#### Context * *node version*: v8.11.3 * *joi version*: 13.5.2 * *environment* (node, browser): express, Chrome * *used with* (hapi, standalone, ...): standalone * *any other relevant information*: none #### What are you trying to achieve or the steps to reproduce ? I'd like to make sure the extra fields that don't belong in my schema don't make it into the collection. I'm trying to save (POST) a product and here's my schema  Here is the route:  #### Which result you had? if I post something like this:  Username and nickName are part of the new object created. #### What did you expect ? I'd expect username and nickName to not make it inside the new object, it is still making it. What am I doing wrong? Thanks guys",What provides that ?,const express = require('express'); const validate = require('express-validation'); const validation = require('./param-validation-product'); const productController = require('./product.controller'); const productRoutes = express.Router();
