repo,issue_link,issue_id,post,question,answer
openzfs/zfs,https://github.com/openzfs/zfs/issues/8411,openzfs_zfs_issues_8411,"zpool corrupt metadata improve error message

### System information Type | Version/Name --- | --- Distribution Name | ArchLinux Distribution Version | latest, rolling Linux Kernel | 4.20.6-arch1-1-ARCH Architecture | AMD64 ZFS Version | 0.7.12_4.20.6.arch1.1-1] SPL Version | 0.7.12_4.20.6.arch1.1-1 ### Describe the problem you're observing This is pretty simple, if any one of my mirrors disappears, for example I have 3 mirrors and only 2 are available, ZFS says the metadata is corrupted and needs to be destroyed and recreated, it slipped my mind that I had 3 mirrors and thought the 2 were normal and I was at a loss with my data. Everything points to lost data as shown below, trying to clear it using 'zpool clear zpool' returns no such pool. Finally, I ran a 'zdb' and found that I have 3 mirrors instead of 2, so I went and checked my drives and something was a little loose and after a reboot I was back in action. It could of been bad if I just recreated it, maybe a good addition would be to show missing disks when a mirror goes missing not just remove it from the zpool status/import commands. zpool import pool: zpool id: state: FAULTED status: The pool metadata is corrupted. action: The pool cannot be imported due to damaged devices or data. The pool may be active on another system, but can be imported using the '-f' flag. see: http://zfsonlinux.org/msg/ZFS-8000-72 config: zpool FAULTED corrupted data ### Describe how to reproduce the problem Pull a mirror out of the pool and boot it up",Can you give us more information about your setup? You seem to have removed the issue template. Thanks edit: possibly related to #8175,"### System information Type | Version/Name --- | --- Distribution Name | ArchLinux Distribution Version | latest, rolling Linux Kernel | 4.20.6-arch1-1-ARCH Architecture | AMD64 ZFS Version | 0.7.12_4.20.6.arch1.1-1] SPL Version | 0.7.12_4.20.6.arch1.1-1 ### Describe the problem you're observing"
openzfs/zfs,https://github.com/openzfs/zfs/issues/9555,openzfs_zfs_issues_9555,"Fedora30,zfs-0.8.2-1 ""cannot receive incremental stream: checksum mismatch or incomplete stream"" on old snapshot

### System information Type | Version/Name --- | --- Distribution Name | Fedora Distribution Version | 30 Linux Kernel | 5.3.7-200 Architecture | x86_64 ZFS Version | 0.8.2-1 SPL Version | 0.8.2-1 ### Describe the problem you're observing Hello. I am reluctant to open this issue since it may not be relevant to many users. This is also the first time I use GitHub so I will try to format my issue properly. I encounter the following error when applying an incremental snapshot:  The error does not occur immediately, but after some time, somewhere within the stream. As the text suggests, the snapshot was created previously and saved to a file; unfortunately it does not exist in a pool anymore. I was able to process the snapshot with , which I understand to indicate that the snapshot is ""valid"" and that the error I received was incorrect.  I have changed the name of the dataset in question to 'x'; I hope this is OK. A number of such incremental snapshots had been applied already without issue. The datetime they were created is indicated as the snapshot name; in general there were several snapshots generated per day, and the last one is dated . So in particular the snapshot at  did not have any issues being applied. I note this just in case it might be an indication of a behavior which was introduced by a version change on the sender that may have occurred between those two times. If necessary, I may be able to establish whether such a version change took place, and specifically which version was in use, if the appropriate records still exist on my system(s). I also tried applying the snapshot using zfs-fuse. In that case, the error message was different:  Other notes: - The system performing the receive is running inside a VM. - The system which performed the send was Fedora, running zfs 0.7, likely 0.7.9 or there-abouts (_Edit: I am doubting whether this is correct, it may have actually been 0.7.12. I recall using 0.7.12 for some time._). I am not sure exactly but I may be able to determine this if I can locate the appropriate records.  on the receiving side:   on the sending side, **as it exists today** (not at 2018-08-30, when the snapshot was created)  Since the application of the snapshot fails mid-file, I was thinking I could maybe isolate where the failure takes place:  and then compare the output of  and , to indicate the block/location which would appear to trigger the error. I'm not sure if this would be useful. I am open to suggestions for whatever steps I should take. ### Describe how to reproduce the problem Install Fedora 30, install zfsonlinux, apply the sequence of snapshots. Unfortunately I do not think I can share the snapshots as they are large and contain sensitive information. Aside from the installation of a few user-applications, the only actions I have taken on this newly installed system have been to install zfsonlinux. ### Include any warning/errors/backtraces from the system logs I was not aware of any. I am available to provide any relevant information. Thank you.","Do you have both the compressed and an uncompressed version on the source? If so, try with the file zstreamdump sees as valid, instead of the compressed one?","(_Edit: I am doubting whether this is correct, it may have actually been 0.7.12. I recall using 0.7.12 for some time._)"
fullcalendar/fullcalendar,https://github.com/fullcalendar/fullcalendar/issues/4756,fullcalendar_fullcalendar_issues_4756,"Issues occur when wrapped in Polymer LitElement

I am trying to wrap Fullcalendar as a Polymer LitElement component. I have encountered two styling issues which probably are caused by missing HTML class. * prev and next on header are not styled. They are displayed as e900 and e901, respectively. * timeGrid view: All cells in focused column instead of the focused single cell are selected. Class fc-highlight is not added after cells are selected. Which key parts have I missed during wrapping? file index.html:  file fc.js:  file ./core-style.js:  file ./daygrid-style.js:  file ./timegrid-style.js:  These source files are bundled with tools _Rollup_ and _BABEL_ into two files index.html and fc.js, which are uploaded to [jsfiddle](https://jsfiddle.net/cnliou/y39pxoq7/) and runnable by Opera v58 (Firefox v60.3 appears to eat up my CPU but not respond). However, command _npm run buid_ prints these warnings: [log.txt](https://github.com/fullcalendar/fullcalendar/files/3365635/log.txt)","Would you be able to post a [runnable, stripped-down demonstration of the bug](http://fullcalendar.io/wiki/Reduced-Test-Cases/)? Would really appreciate it because the time saved reproducing will be time spent fixing.","import {timeGridStyle} from './timegrid-style.js'; import '@fullcalendar/interaction/main.js'; dayGrid','Month,timeGrid,timeGridDay file ./core-style.js:  file ./daygrid-style.js:  file ./timegrid-style.js:  These files are bundled with tools _Rollup_ and _BABEL_ into two files index.html and fc.js, which is runnable at [jsfiddle](https://jsfiddle.net/cnliou/y39pxoq7/2/) by Opera (Firefox appears to eat up CPU but not respond). However, command _npm run buid_ prints these warnings: [log.txt](https://github.com/fullcalendar/fullcalendar/files/3365635/log.txt)"
fullcalendar/fullcalendar,https://github.com/fullcalendar/fullcalendar/issues/4999,fullcalendar_fullcalendar_issues_4999,"The last timeslot is wider than the slotWidth if the slotWidth is small enough that the slots do not fill the width of the calendar

I am using the ""resource timeline"" and a very low slotWidth setting of 6 or 8. (with tiny font-size) but the right column behaves wrong on most responsive points. View it here: ![Screenshot 2019-08-23 at 08 45 41](https://user-images.githubusercontent.com/14107298/63572767-f7c85600-c583-11e9-98c1-c256ba6fb31d.png) On responsive points it jumps to the correct size but on places more of the responsive points the column gets bigger. I guess it is a bug? I'm going to define my own exact widths for fullCalendar as a solution on the outer wrapper to solve this. So the wrapper always jumps to the points that it looks good. Edit: Here is the codepen https://codepen.io/Julesezaar/pen/oNvZrjy?&editable=true&editors=001","Would you be able to post a [runnable, stripped-down demonstration of the bug](http://fullcalendar.io/wiki/Reduced-Test-Cases/)? Would really appreciate it because the time saved reproducing will be time spent fixing.",Edit: Here is the codepen https://codepen.io/Julesezaar/pen/oNvZrjy?&editable=true&editors=001
fullcalendar/fullcalendar,https://github.com/fullcalendar/fullcalendar/issues/5037,fullcalendar_fullcalendar_issues_5037,"Internet Explorer 11 Timeline Year View on remote desktop session displays dates with longdatestring

On Internet Explorer 11 on the remote desktop session at the company I work for the dates display in long format - stretching the days and the events. ![image](https://user-images.githubusercontent.com/55244693/64792637-9f2c1d80-d571-11e9-9896-f5c0f8743e02.png) This issue only occurs on Internet Explorer 11 and not on any other browser on the remote desktop session, such as Chrome as can be seen below. ![image](https://user-images.githubusercontent.com/55244693/64792912-1497ee00-d572-11e9-9846-d965d63e9655.png) Screenshot of calendar setup - ![image](https://user-images.githubusercontent.com/55244693/64844393-93873800-d5ff-11e9-953b-37999927bed9.png) If I use Internet Explorer 11 off the remote desktop session this issue does not occur. I was just wondering if this issue has happened before and if anyone has any solutions or ideas about how to resolve it. Thanks.","Would you be able to post a [runnable, stripped-down demonstration of the bug](http://fullcalendar.io/wiki/Reduced-Test-Cases/)? Would really appreciate it because the time saved reproducing will be time spent fixing.",Screenshot of calendar setup - ![image](https://user-images.githubusercontent.com/55244693/64844393-93873800-d5ff-11e9-953b-37999927bed9.png)
vanilla/vanilla,https://github.com/vanilla/vanilla/issues/8858,vanilla_vanilla_issues_8858,"Attachment Upload Problem

Attachment failed to add to comment with error message 'You are not allowed to upload files in this category'. 1. Enable permissions on attachments. 1. Activate Advanced Editor. 1. Click the add file - uploads OK. 1. Click to 'Post Comment' 1. Error message displayed Seems to be class.editor.plugin.php line 998 **original:** && $category['AllowFileUploads'] !==1 **suggested:** && $category['AllowFileUploads'] !=1 on local IIS the value of $category['AllowFileUploads'] is 1, on Linux shared hosting $category['AllowFileUploads'] is ""1""",Could you describe the hosting environment where you're having issues in more detail? - PHP version - DB version,1. 1. 1. 1. 1. **
celery/celery,https://github.com/celery/celery/issues/5836,celery_celery_issues_5836,"celery worker has --quiet to suppress banner output but celery beat does not

Sorry for leaving out the issue template but I believe this is fairly trivial and straight-forward. In master, there is code to enable the suppressing of printing the banner when running celery worker with --quiet: https://github.com/celery/celery/blob/9773eba837982c84380c93bd3788470273e7674d/celery/apps/worker.py#L138-L139 This conditional is not present in the code that runs celery beat: https://github.com/celery/celery/blob/9773eba837982c84380c93bd3788470273e7674d/celery/apps/beat.py#L77-L78 https://github.com/celery/celery/blob/9773eba837982c84380c93bd3788470273e7674d/celery/apps/beat.py#L100 This causes a few issues for us because we expect all our services to only emit JSON.",do you have the time to send improvements?,This causes a few issues for us because we expect all our services to only emit JSON.
celery/celery,https://github.com/celery/celery/issues/4885,celery_celery_issues_4885,"High memory usage in producer code while using apply_async in celery 4.1 with Redis as a broker

**Update: O/p of /usr/bin/celery -A proj report** software -> celery:4.1.0 (latentcall) kombu:4.1.0 py:3.6.2 billiard:3.5.0.3 redis:2.10.6 platform -> system:Linux arch:64bit, ELF imp:CPython loader -> celery.loaders.app.AppLoader settings -> transport:redis results:redis://:**@127.0.0.1:6379/1 BROKER_URL: 'redis://:********@127.0.0.1:6379/1' CELERY_RESULT_BACKEND: 'redis://:********@127.0.0.1:6379/1' CELERY_INCLUDE: ['services.tasks'] CELERY_TASK_RESULT_EXPIRES: '5' CELERY_ACCEPT_CONTENT: ['json'] CELERY_RESULT_SERIALIZER: 'json' CELERY_ACKS_LATE: 'True' CELERYD_PREFETCH_MULTIPLIER: '1' BROKER_TRANSPORT_OPTIONS: { 'visibility_timeout': 43200} BROKER_TRANSPORT_OPTIONS: { 'visibility_timeout': 43200} CELERY_RESULT_SERIALIZER: 'json' CELERY_ACCEPT_CONTENT: ['json'] CELERY_ACKS_LATE: 'True' CELERY_TASK_RESULT_EXPIRES: '5' CELERYD_PREFETCH_MULTIPLIER: '1' Hi, we have producer code which keeps on running and inserts tasks in a Redis , where consumer code picks tasks from the Redis and perform certain operations. Now after certain days we observe strange behaviour with prouder process where memory usage of producer shoots up drastically. For example: after running 10-15 days memory usage remains ~500 MB but then it shoots up to ~20 GB and then keep on increasing. We observe following logs in producer code: **Could not insert task with error[maximum recursion depth exceeded]** Traceback (most recent call last): File ""/usr/lib/python3.6/site-packages/redis/connection.py"", line 590, in send_packed_command self._sock.sendall(item) ConnectionResetError: [Errno 104] Connection reset by peer During handling of the above exception, another exception occurred: Traceback (most recent call last): File ""/usr/lib/python3.6/site-packages/redis/client.py"", line 2408, in _execute return command(*args) File ""/usr/lib/python3.6/site-packages/redis/connection.py"", line 610, in send_command self.send_packed_command(self.pack_command(*args)) File ""/usr/lib/python3.6/site-packages/redis/connection.py"", line 603, in send_packed_command (errno, errmsg)) redis.exceptions.ConnectionError: Error 104 while writing to socket. Connection reset by peer. During handling of the above exception, another exception occurred: Traceback (most recent call last): File ""file.py"", line 975, in <module> serializer=common.serializer_value) File ""/usr/lib/python3.6/site-packages/celery/app/task.py"", line 536, in apply_async **options File ""/usr/lib/python3.6/site-packages/celery/app/base.py"", line 736, in send_task self.backend.on_task_call(P, task_id) File ""/usr/lib/python3.6/site-packages/celery/backends/redis.py"", line 189, in on_task_call self.result_consumer.consume_from(task_id) File ""/usr/lib/python3.6/site-packages/celery/backends/redis.py"", line 76, in consume_from self._consume_from(task_id) File ""/usr/lib/python3.6/site-packages/celery/backends/redis.py"", line 82, in _consume_from self._pubsub.subscribe(key) File ""/usr/lib/python3.6/site-packages/redis/client.py"", line 2482, in subscribe ret_val = self.execute_command('SUBSCRIBE', *iterkeys(new_channels)) File ""/usr/lib/python3.6/site-packages/redis/client.py"", line 2404, in execute_command self._execute(connection, connection.send_command, *args) File ""/usr/lib/python3.6/site-packages/redis/client.py"", line 2415, in _execute connection.connect() File ""/usr/lib/python3.6/site-packages/redis/connection.py"", line 502, in connect callback(self) File ""/usr/lib/python3.6/site-packages/redis/client.py"", line 2376, in on_connect self.subscribe(**channels) **Also we get following error message in Redis logs:** Client id=1665824 addr=127.0.0.1:56318 fd=125 name= age=8 idle=0 flags=N db=1 sub=835676 psub=0 multi=-1 qbuf=0 qbuf-free=32768 obl=0 oll=4259 omem=104778152 events=rw cmd=subscribe scheduled to be closed ASAP for overcoming of output buffer limits. ******Please Note:** On different servers we get recursion depth exceeded error and error mentioned in Redis.log but stack trace is not printed on every server. So it seems to suggest that either there is some issue when we exceed recursion depth while performing ""apply_async"" or issue is with client output buffer of Redis. Also we don't see significant increase in memory usage of Redis as that in case of producer code.** I am not able to figure out exact root cause, any help will be much appreciated. Thanks in advance.",Could you try upgrading and report back? Thanks.,"**Update: O/p of /usr/bin/celery -A proj report** software -> celery:3.1.16 (Cipater) kombu:3.0.23 py:2.6.6 billiard:3.3.0.18 redis:2.10.3 platform -> system:Linux arch:64bit, ELF imp:CPython loader -> celery.loaders.app.AppLoader settings -> transport:redis results:redis://:WAjvGxey5vj52TFGQdVHxpgXE9Ez6Z7KTaYBJeYan9PXSGw8zMGTaszeya7D9pJh@127.0.0.1:6379/1 BRT_OPTION{ 'visibility_timeout': 43200} NTENT: ['json'] CELERY_ACK"
celery/celery,https://github.com/celery/celery/issues/5229,celery_celery_issues_5229,"Issue with chord group task exceptions and Redis backend

## Checklist - [x] I have included the output of celery -A proj report in the issue. (if you are not able to do this, then at least specify the Celery version affected). - [x] I have verified that the issue exists against the master branch of Celery. software -> celery:4.2.0 (windowlicker) kombu:4.2.1 py:2.7.15 billiard:3.5.0.3 py-amqp:2.2.2 platform -> system:Darwin arch:64bit imp:CPython loader -> celery.loaders.app.AppLoader settings -> transport:pyamqp results:redis://localhost:6379/0 task_serializer: 'pickle' task_soft_time_limit: 3600 redis_max_connections: None task_bucket: 'tasks' enable_utc: True beat_scheduler: beat_max_loop_interval: 5 worker_redirect_stdouts: False accept_content: ['pickle'] result_serializer: 'pickle' broker_pool_limit: 10 db_port: '8091' task_acks_late: False result_expires: 86400 task_track_started: True task_routes: { '': { 'queue': 'priority.high'}} str_to_bool: <function str_to_bool at 0x10744daa0> db_user: 'i' db_host: 'localhost' broker_url: u'amqp://guest:********@localhost:5672//' result_backend: u'redis://localhost:6379/0' ## Steps to reproduce ### testrunner.py  ### tasks.py  ## Expected behavior Tasks exception is handled properly and the state of the task is set to failed on the backend. No crash to the celery worker. ## Actual behavior  This seems to be an issue with the request.chord dict getting passed to the maybe_signature() method in celery/backends/redis.py on line 358.  This is then passed into Signature.from_dict(). Here there is no verification code on the dictionary so it creates a signature without an ID property. This then gets passed into self.chord_error_from_stack()  Then this method tries a few times to use callback.id to set the failed state on the backend. Since there is no callback.id property these generates and internal exception. In celery 4.1.1 this does not crash the worker but the task is never set to a failed state it is always stuck in a started state. In celery 4.2.0 (master) this causes the worker to crash but the cleanup processes sets the state of the task to failed. A hacky work around is to add this to check if callback.id is None and if so set it to the desired task id held inside of callback.tasks[n].id",Do you happen to have a test case that will help me reproduce the problem?,### testrunner.py  ### tasks.py 
pkp/pkp-lib,https://github.com/pkp/pkp-lib/issues/3721,pkp_pkp-lib_issues_3721,"[OJS 3.1.1] missing locale key grid.action.schedulePublication

In Production stage, is missing a string of text grid.action.schedulePublication for html title: ![captura de pantalla 2018-05-22 00 22 57](https://user-images.githubusercontent.com/5422984/40342283-d9ce84ca-5d57-11e8-8bcb-df4caf840ff8.png) (Edit: also grid.action.viewEmail https://github.com/pkp/pkp-lib/issues/3742)",What version are you on?,(Edit: also grid.action.viewEmail https://github.com/pkp/pkp-lib/issues/3742)
ohmyzsh/ohmyzsh,https://github.com/ohmyzsh/ohmyzsh/issues/6907,ohmyzsh_ohmyzsh_issues_6907,"git plugin not working

not sure what I'm doing wrong but I installed zsh with homebrew using brew install zsh I'm running this in **OS X Sierra** I'm trying these commends in **iTerm2** echo $SHELL returns /bin/bash zsh --version returns: **zsh 5.2 (x86_64-apple-darwin16.0)** $SHELL --version gives me **zsh 5.2 (x86_64-apple-darwin16.0)** **curl** is installed Here's my ~/.zshrc file:  Tried a command such as gco and got zsh: command not found: gco","What's the output of alias gco, echo $plugins, and ls $ZSH/plugins?",** I'm trying these commends in **iTerm2
ohmyzsh/ohmyzsh,https://github.com/ohmyzsh/ohmyzsh/issues/5162,ohmyzsh_ohmyzsh_issues_5162,"failed to load module zsh/datetime'

**TL;DR:** should be fixed by using the same zsh binary as the one being executed ---- I installed oh-my-zsh on a remote machine. It gives the following error every time a zsh shell starts:  This is odd because when I run zmodload zsh/datetime in the shell, it works. What could be causing this?",How did you solve it? Was it a difference between the zsh used in $SHELL and the zsh used by respecting the $PATH order?,**TL;DR:** should be fixed by using the same zsh binary as the one being executed ----
ohmyzsh/ohmyzsh,https://github.com/ohmyzsh/ohmyzsh/issues/8452,ohmyzsh_ohmyzsh_issues_8452,"cd command sometimes hangs

<!-- Fill this out before posting. You can delete irrelevant sections, but an issue where no sections have been filled will be deleted without comment. --> **Describe the bug** when I input cd command , the cursor stays at the start of line , then type any key can make it continue working. it happens sometimes. when I set ZSH_THEME to """", cd command works well . **To Reproduce** hard to reproduce, it happens randomly **Screenshots or recordings** the cursor stays at the start of line ![image](https://user-images.githubusercontent.com/4841386/70144096-281da580-16d8-11ea-8f48-7e6cddacbb8d.png) **System:** - OS: macOS - Zsh version: 5.7.1 - Terminal emulator: Term2","Can you explain more? It's not clear what you mean by stopped, or what it's supposed to happen in that screenshot.","to """" **To Reproduce** hard to reproduce, it happens randomly **Screenshots or recordings** the cursor stays at the start of line **System:** - OS: macOS - Zsh version: 5.7.1 - Terminal emulator: Term2"
expressjs/express,https://github.com/expressjs/express/issues/4246,expressjs_express_issues_4246,"Router should honour disabling 'X-Powered-By' on app

NOTE: Not an issue. I was importing express instead of Router, like import Router from 'express'. This was due to using node experimental esm support via ""type"": ""module"" set in package.json. If I try to import Router the correct way - import { Router } from 'express' - it yells at me: SyntaxError: The requested module 'express' does not provide an export named 'Router'. Using express.Router() solves the issue. I can set app.disable('x-powered-by') and it will stop emitting the header alright. But then I have to do it for every instance for Router() as well, as in: router.disable('x-powered-by'). This is not a major issue in a small scale projects but becomes a PITA when there's many router instance spread across numerous files. Code repetition, even if it is one line is not fun ;-) Can Router() read global app settings and use those _if_ they differ from the defaults or those not explicitly set on the Router()'s instance? Or perhaps I missed something here? [Repo to reproduce the issue](https://gitlab.com/b00jum/x-powered-by).",Can you provide an example reproduction case?,[Repo to reproduce the issue](https://gitlab.com/b00jum/x-powered-by).
sbt/sbt,https://github.com/sbt/sbt/issues/5427,sbt_sbt_issues_5427,"Macros in Scala.js No Longer Access the JVM

**Steps** 1. Write a Macro that makes use of java.io.File 2. Use that Macro in a Scala.js enabled project **Problems** As of 1.3.4, I get errors Referring to non-existent class java.io.File **Expectations** Previous to 1.3.4, this would work just fine and any JVM operation could be dealt with inside the Macro.",Could you follow the issue template and the bug report guideline please? https://github.com/sbt/sbt/blob/develop/CONTRIBUTING.md#what-to-report,**Steps** 1. Write a Macro that makes use of java.io.File 2. Use that Macro in a Scala.js enabled project **Problems** 
sbt/sbt,https://github.com/sbt/sbt/issues/5400,sbt_sbt_issues_5400,"Upgrading Play Project to 1.3.7 triggers incorrect warnings

sbt version: *1.3.7* ## steps https://github.com/hmrc/cgt-property-disposals-frontend Clone it, open up an sbt session and run compile. You will see the warnings. ## problem Upgrading a Play 2.6 project to use sbt 1.3.7 is triggering warnings on Twirl templates having unused imports:  That is actually a Twirl comment. and  This Play route is actually used. ## expectation Should not trigger warnings in these cases.",Could you follow https://github.com/sbt/sbt/blob/develop/CONTRIBUTING.md#what-to-report and describe the steps needed to reproduce the problems on our machines please?,"steps https://github.com/hmrc/cgt-property-disposals-frontend Clone it, open up an sbt session and run compile. You will see the warnings. ##"
