repo,issue_link,issue_id,post,question,answer
numba/numba,https://github.com/numba/numba/issues/3027,numba_numba_issues_3027,"Numba reassigns sys.stdout

<!-- Thanks for opening an issue! To help the Numba team handle your information efficiently, please first ensure that there is no other issue present that already describes the issue you have (search at https://github.com/numba/numba/issues?&q=is%3Aissue). If there is no issue present please jump to a section below and delete the irrelevant one depending on whether you are: * Making a feature request. * Reporting a bug. For more general ""how do I do X?"" type questions, please speak to us in real time on https://gitter.im/numba/numba or post to the Numba mailing list https://groups.google.com/a/continuum.io/forum/#!forum/numba-users. --> ## Reporting a bug <!-- Before submitting a bug report please ensure that you can check off these boxes: --> - [*] I am using the latest released version of Numba (most recent is visible in the change log (https://github.com/numba/numba/blob/master/CHANGE_LOG). - [*] I have included below a minimal working reproducer (if you are unsure how to write one see http://matthewrocklin.com/blog/work/2018/02/28/minimal-bug-reports).  I came across this because it breaks the IntelliJ unittest runner (which sets sys.stdout before numba), like so: https://youtrack.jetbrains.com/issue/PY-23940 , which causes and exception after running unit tests. It would be more friendly if numba didn't poke at sys. Seen in: numba==0.38.1",Which OS are you trying this on? Is there anything else you think that might be special about your set up that could be influencing such behaviours?,") # Does not reassign stdout print>>sys.stderr, sys.api_version, sys.stdout # 12345, None f1(0,1"
ycm-core/YouCompleteMe,https://github.com/ycm-core/YouCompleteMe/issues/3219,ycm-core_YouCompleteMe_issues_3219,"java completer stuck at 100%, never loads

# Issue Prelude **Please complete these steps and check these boxes (by putting an x inside the brackets) _before_ filing your issue:** - [x] I have read and understood YCM's [CONTRIBUTING][cont] document. - [x] I have read and understood YCM's [CODE_OF_CONDUCT][code] document. - [x] I have read and understood YCM's [README][readme], **especially the [Frequently Asked Questions][faq] section.** - [x] I have searched YCM's issue tracker to find issues similar to the one I'm about to report and couldn't find an answer to my problem. ([Example Google search.][search]) - [x] If filing a bug report, I have included the output of vim --version. - [x] If filing a bug report, I have included the output of :YcmDebugInfo. - [x] If filing a bug report, I have attached the contents of the logfiles using the :YcmToggleLogs command. - [x] If filing a bug report, I have included which OS (including specific OS version) I am using. - [x] If filing a bug report, I have included a minimal test case that reproduces my issue, including what I expected to happen and what actually happened. - [x] If filing a installation failure report, I have included the entire output of install.py (or cmake/make/ninja) including its invocation - [x] **I understand this is an open-source project staffed by volunteers and that any help I receive is a selfless, heartfelt _gift_ of their free time. I know I am not entitled to anything and will be polite and courteous.** - [x] **I understand my issue may be closed if it becomes obvious I didn't actually perform all of these steps.** Thank you for adhering to this process! It ensures your issue is resolved quickly and that neither your nor our time is needlessly wasted. # Issue Details * What did you do? Just opening vim a lot to edit java files. Also was experimenting today with UltiSnips. * What did you expect to happen? YouCompleteMe helps me write java (it happened at the start) * What actually happened? halfway through today the java completer gets stuck at Initializing Java completer: 100% Starting Java Language Server - Resolve plugin dependency # Diagnostic data ## Output of vim --version  ## Output of YcmDebugInfo  ## Contents of YCM, ycmd and completion engine logfiles https://gist.github.com/theonlygusti/02486525d638774b768103f0a84f2e76 ## OS version, distribution, etc. macOS 10.14 Mojave ## Output of build/install commands [cont]: https://github.com/Valloric/YouCompleteMe/blob/master/CONTRIBUTING.md [code]: https://github.com/Valloric/YouCompleteMe/blob/master/CODE_OF_CONDUCT.md [readme]: https://github.com/Valloric/YouCompleteMe/blob/master/README.md [faq]: https://github.com/Valloric/YouCompleteMe/blob/master/README.md#faq [search]: https://www.google.com/search?q=site%3Ahttps%3A%2F%2Fgithub.com%2FValloric%2FYouCompleteMe%2Fissues%20python%20mac [gist]: https://gist.github.com/",Where are the log files?,- Resolve plugin dependency
ycm-core/YouCompleteMe,https://github.com/ycm-core/YouCompleteMe/issues/3256,ycm-core_YouCompleteMe_issues_3256,"Error occurs when opening vim.

# Issue Prelude **Please complete these steps and check these boxes (by putting an x inside the brackets) _before_ filing your issue:** - [ ] I have read and understood YCM's [CONTRIBUTING][cont] document. - [ ] I have read and understood YCM's [CODE_OF_CONDUCT][code] document. - [ ] I have read and understood YCM's [README][readme], **especially the [Frequently Asked Questions][faq] section.** - [ ] I have searched YCM's issue tracker to find issues similar to the one I'm about to report and couldn't find an answer to my problem. ([Example Google search.][search]) - [ ] If filing a bug report, I have included the output of vim --version. - [ ] If filing a bug report, I have included the output of :YcmDebugInfo. - [ ] If filing a bug report, I have attached the contents of the logfiles using the :YcmToggleLogs command. - [ ] If filing a bug report, I have included which OS (including specific OS version) I am using. - [ ] If filing a bug report, I have included a minimal test case that reproduces my issue, including what I expected to happen and what actually happened. - [ ] If filing a installation failure report, I have included the entire output of install.py (or cmake/make/ninja) including its invocation - [ ] **I understand this is an open-source project staffed by volunteers and that any help I receive is a selfless, heartfelt _gift_ of their free time. I know I am not entitled to anything and will be polite and courteous.** - [ ] **I understand my issue may be closed if it becomes obvious I didn't actually perform all of these steps.** Thank you for adhering to this process! It ensures your issue is resolved quickly and that neither your nor our time is needlessly wasted. # Issue Details Error occurs when opening vim. YouCompleteMe unavailable: 'utf-8' codec can't decode byte 0xbc in position 9: i nvalid start byte My installation steps: Follow the github readme installation tutorial. I installed python2.7.15(the test was successful) and Visual Studio 2015 first. Added set encoding=utf-8 Then execute git clone at ~/.vim/bundle https://github.com/Valloric/YouCompleteMe.git, cd YouCompleteMe executes git submodule update --init --recursive After successfully completing this, I open vim and give an error: YouCompleteMe unavailable: 'utf-8' codec can't decode byte 0xbc in position 9: i nvalid start byte After that, I successfully compiled YCM with ./install.py, opened vim again, and still reported the above content (using cmake --build . --target ycm_core --config Release after compiling successfully, the same is true.) Why is there such a problem? How to solve it? # Diagnostic data ## Output of vim --version  ## Output of YcmDebugInfo E492: Not an editor command: YcmDebugInfo ## Opening vim and enter the command :message:  ## Contents of YCM, ycmd and completion engine logfiles E492: Not an editor command: YcmToggleLogs ## .vimrc file  ## OS version, distribution, etc. Windows 10, 10.0.17134, x64-based ## Output of build/install commands [cont]: https://github.com/Valloric/YouCompleteMe/blob/master/CONTRIBUTING.md [code]: https://github.com/Valloric/YouCompleteMe/blob/master/CODE_OF_CONDUCT.md [readme]: https://github.com/Valloric/YouCompleteMe/blob/master/README.md [faq]: https://github.com/Valloric/YouCompleteMe/blob/master/README.md#faq [search]: https://www.google.com/search?q=site%3Ahttps%3A%2F%2Fgithub.com%2FValloric%2FYouCompleteMe%2Fissues%20python%20mac [gist]: https://gist.github.com/",Does your username contain such characters?, filetype plugin indent on
ycm-core/YouCompleteMe,https://github.com/ycm-core/YouCompleteMe/issues/3455,ycm-core_YouCompleteMe_issues_3455,"in macvim scrolling or deleting a line with 'x' in normal mode stutters

# Issue Prelude **Please complete these steps and check these boxes (by putting an x inside the brackets) _before_ filing your issue:** - [X] I have read and understood YCM's [CONTRIBUTING][cont] document. - [X] I have read and understood YCM's [CODE_OF_CONDUCT][code] document. - [X] I have read and understood YCM's [README][readme], **especially the [Frequently Asked Questions][faq] section.** - [X] I have searched YCM's issue tracker to find issues similar to the one I'm about to report and couldn't find an answer to my problem. ([Example Google search.][search]) - [X] If filing a bug report, I have included the output of vim --version. - [X] If filing a bug report, I have included the output of :YcmDebugInfo. - [X] If filing a bug report, I have attached the contents of the logfiles using the :YcmToggleLogs command. - [X] If filing a bug report, I have included which OS (including specific OS version) I am using. - [X] If filing a bug report, I have included a minimal test case that reproduces my issue, including what I expected to happen and what actually happened. - [ ] If filing a installation failure report, I have included the entire output of install.py (or cmake/make/ninja) including its invocation - [X] **I understand this is an open-source project staffed by volunteers and that any help I receive is a selfless, heartfelt _gift_ of their free time. I know I am not entitled to anything and will be polite and courteous.** - [X] **I understand my issue may be closed if it becomes obvious I didn't actually perform all of these steps.** Thank you for adhering to this process! It ensures your issue is resolved quickly and that neither your nor our time is needlessly wasted. # Issue Details * What did you do? In macvim in a buffer of C code with a many lines and warnings/errors, scrolling stutters, i.e. on scrolling from time to time it slows down for a while 1) create a big file named 'long_file.c' (which will give many warnings) with the following python script:  2) open latter file in macvim with the command: 3) start scrolling or delete a line with 'x' in normal mode and it significantly stutters. Note that for large files even if there are no many error/warnings deleting with 'x' in normal mode stutters. E.g. use the following python script to generate a c file, open it with vim and try to delete the line 'int b=3; b=a+1 [...]' with 'x' in normal mode:  if I disable YouCompleteMe scrolling of 'long_file.c' (or deleting characters with 'x' in normal mode) is smooth.With YouComplete disabled, if I use ALE (https://github.com/dense-analysis/ale) with clang linter, scrolling is also smooth as expected. Similarly with YouCompleteMe disable, if I use deoplete and I delete a line in normal mode with 'x', there is no stuttering/lag . I also exploited vim built-in profile capabilities to obtain the following: FUNCTIONS SORTED ON SELF TIME count total (s) self (s) function 523 0.623111 0.589660 <SNR>68_OnCursorMovedNormalMode() 3024 0.104882 ObsessionStatus() 523 0.098218 <SNR>50_Highlight_Matching_Pair() 2016 0.100606 0.077198 gutentags#inprogress() 523 0.028446 0.025770 <SNR>68_AllowedToCompleteInBuffer() 3024 0.129015 0.024133 Obstat() 2016 0.023408 gutentags#find_job_index_by_tags_file() 2016 0.122254 0.021648 gutentags#statusline() 1008 0.016041 lightline#link() 2016 0.133758 0.011504 GThelper() 523 0.033451 0.005005 <SNR>68_AllowedToCompleteInCurrentBuffer() 523 0.004786 lightline#update_once() 1008 0.004608 lightline#mode() 523 0.002676 <SNR>68_DisableOnLargeFile() * What did you expect to happen? * What actually happened? # Diagnostic data ## Output of vim --version VIM - Vi IMproved 8.1 (2018 May 18, compiled Jul 28 2019 01:07:30) macOS version Included patches: 1-1722 Compiled by travis@Traviss-Mac.local Huge version with MacVim GUI. Features included (+) or not (-): +acl +file_in_path +mouse_urxvt -tcl +arabic +find_in_path +mouse_xterm +termguicolors +autocmd +float +multi_byte +terminal +autochdir +folding +multi_lang +terminfo -autoservername -footer -mzscheme +termresponse +balloon_eval +fork() +netbeans_intg +textobjects +balloon_eval_term +fullscreen +num64 +textprop +browse -gettext +odbeditor +timers ++builtin_terms -hangul_input +packages +title +byte_offset +iconv +path_extra +toolbar +channel +insert_expand +perl/dyn +transparency +cindent +job +persistent_undo +user_commands +clientserver +jumplist +postscript +vartabs +clipboard +keymap +printer +vertsplit +cmdline_compl +lambda +profile +virtualedit +cmdline_hist +langmap +python/dyn +visual +cmdline_info +libcall +python3/dyn +visualextra +comments +linebreak +quickfix +viminfo +conceal +lispindent +reltime +vreplace +cryptv +listcmds +rightleft +wildignore +cscope +localmap +ruby/dyn +wildmenu +cursorbind +lua/dyn +scrollbind +windows +cursorshape +menu +signs +writebackup +dialog_con_gui +mksession +smartindent -X11 +diff +modify_fname -sound -xfontset +digraphs +mouse +spell +xim +dnd +mouseshape +startuptime -xpm -ebcdic +mouse_dec +statusline -xsmp +emacs_tags -mouse_gpm -sun_workshop -xterm_clipboard +eval -mouse_jsbterm +syntax -xterm_save +ex_extra +mouse_netterm +tag_binary +extra_search +mouse_sgr -tag_old_static -farsi -mouse_sysmouse -tag_any_white system vimrc file: ""$VIM/vimrc"" user vimrc file: ""$HOME/.vimrc"" 2nd user vimrc file: ""~/.vim/vimrc"" user exrc file: ""$HOME/.exrc"" system gvimrc file: ""$VIM/gvimrc"" user gvimrc file: ""$HOME/.gvimrc"" 2nd user gvimrc file: ""~/.vim/gvimrc"" defaults file: ""$VIMRUNTIME/defaults.vim"" system menu file: ""$VIMRUNTIME/menu.vim"" fall-back for $VIM: ""/Applications/MacVim.app/Contents/Resources/vim"" Compilation: clang -c -I. -Iproto -DHAVE_CONFIG_H -DFEAT_GUI_MACVIM -Wall -Wno-unknown-pragmas -pipe -DMACOS_X -DMACOS_X_DARWIN -g -O2 -U_FORTIFY_SOURCE -D_FORTIFY_SOURCE=1 Linking: clang -L. -fstack-protector-strong -L/usr/local/lib -L/usr/local/opt/libyaml/lib -L/usr/local/opt/openssl/lib -L/usr/local/opt/readline/lib -L. -fstack-protector-strong -L/usr/local/lib -L/usr/local/opt/libyaml/lib -L/usr/local/opt/openssl/lib -L/usr/local/opt/readline/lib -L/usr/local/lib -o Vim -framework Cocoa -framework Carbon -lm -lncurses -liconv -framework AppKit -fstack-protector -L/System/Library/Perl/5.18/darwin-thread-multi-2level/CORE ## Output of YcmDebugInfo Printing YouCompleteMe debug information... -- Client logfile: /var/folders/26/9q3nft3x4xg2zbj45nzm__100000gn/T/ycm_ymwyp5l1.log -- Server Python interpreter: /usr/local/opt/python/bin/python3.7 -- Server Python version: 3.7.4 -- Server has Clang support compiled in: True -- Clang version: clang version 8.0.0 (tags/RELEASE_800/final) -- Extra configuration file found and loaded -- Extra configuration path: /Users/demichel/.ycm_extra_conf.py -- Server running at: http://127.0.0.1:59867 -- Server process ID: 42290 -- Server logfiles: -- /var/folders/26/9q3nft3x4xg2zbj45nzm__100000gn/T/ycmd_59867_stdout_3ja58z2c.log -- /var/folders/26/9q3nft3x4xg2zbj45nzm__100000gn/T/ycmd_59867_stderr_0g8xcqpb.log ## Contents of YCM, ycmd and completion engine logfiles 2019-07-31 20:40:33,482 - ERROR - HTTPConnectionPool(host='127.0.0.1', port=59882): Max retries exceeded with url: /ready (Caused by NewConnectionError('<urllib3.connection.HTTPConnection object at 0x10569bfd0>: Failed to establish a new connection: [Errno 61] Connection refused')) 2019-07-31 20:40:33,587 - ERROR - HTTPConnectionPool(host='127.0.0.1', port=59882): Max retries exceeded with url: /ready (Caused by NewConnectionError('<urllib3.connection.HTTPConnection object at 0x1056af550>: Failed to establish a new connection: [Errno 61] Connection refused')) ----------- 2019-07-31 20:41:26,589 - INFO - No Clangd executable found in /Users/demichel/.vim/bundle/YouCompleteMe/third_party/ycmd/third_party/clangd/output/bin 2019-07-31 20:41:27,197 - INFO - Received filetype completion available request 2019-07-31 20:41:39,464 - INFO - Received debug info request 2019-07-31 20:41:50,912 - INFO - Received debug info request 2019-07-31 20:42:24,138 - INFO - Received debug info request ----------- 2019-07-31 20:41:26,589 - INFO - No Clangd executable found in /Users/demichel/.vim/bundle/YouCompleteMe/third_party/ycmd/third_party/clangd/output/bin 2019-07-31 20:41:27,197 - INFO - Received filetype completion available request 2019-07-31 20:41:39,464 - INFO - Received debug info request 2019-07-31 20:41:50,912 - INFO - Received debug info request 2019-07-31 20:42:24,138 - INFO - Received debug info request 2019-07-31 20:42:38,839 - INFO - Received debug info request 2019-07-31 20:42:38,840 - ERROR - Error retrieving completer debug info Traceback (most recent call last): File ""/Users/demichel/.vim/bundle/YouCompleteMe/third_party/ycmd/ycmd/handlers.py"", line 234, in DebugInfo request_data ).DebugInfo( request_data ) File ""/Users/demichel/.vim/bundle/YouCompleteMe/third_party/ycmd/ycmd/handlers.py"", line 298, in _GetCompleterForRequestData return _server_state.GetFiletypeCompleter( request_data[ 'filetypes' ] ) File ""/Users/demichel/.vim/bundle/YouCompleteMe/third_party/ycmd/ycmd/server_state.py"", line 100, in GetFiletypeCompleter current_filetypes ) ) ValueError: No semantic completer exists for filetypes: [''] ## OS version, distribution, etc. mac osx Mojave 10.14.6 (up-to-date) macboopro 13-inch, 2016, Four Thunderbolt 3 Ports processor: 3,3 GHz Intel Core i7 memory: 16 GB 2133 MHz LPDDR3 graphic adapter: Intel Iris Graphics 550 1536 MB ## Output of build/install commands [cont]: https://github.com/Valloric/YouCompleteMe/blob/master/CONTRIBUTING.md [code]: https://github.com/Valloric/YouCompleteMe/blob/master/CODE_OF_CONDUCT.md [readme]: https://github.com/Valloric/YouCompleteMe/blob/master/README.md [faq]: https://github.com/Valloric/YouCompleteMe/blob/master/README.md#faq [search]: https://www.google.com/search?q=site%3Ahttps%3A%2F%2Fgithub.com%2FValloric%2FYouCompleteMe%2Fissues%20python%20mac [gist]: https://gist.github.com/",does it get better if you let g:ycm_show_diagnostics_ui = 0 in your vimrc ?,* ** ** *
ycm-core/YouCompleteMe,https://github.com/ycm-core/YouCompleteMe/issues/3608,ycm-core_YouCompleteMe_issues_3608,"Backspace not working + Documentation-help is broken (Edit 3+ gif)

# Issue Description (Edited 3 + gif) Here I provide an updated gif narrowing down the whole problem: ![Tr2](https://user-images.githubusercontent.com/18029016/75618163-46296380-5b6a-11ea-98d0-5d77398f1b67.gif) Steps: 1. Open an empty file with vim. 2. Start writing: import numpy as np 3. New line: a = np.arr 4. You see the doc appears somehow broken... 5. I select ""array"" 6. Part of the doc info has sticked there 7. I finish the statement: a = np.array(x) 8. Once created the last ), I create a new line by pressing ENTER key 9. I am still in INSERT mode, I am pressing BACKSPACE, but it does not erase the content of the line or any other line. 10. I go to the documentation splitted window, by pressing ESC, and Ctrl W W 11. I quit, pressing :q 12. docu window closes ok 13. I am now again in INSERT mode, I am pressing BACKSPACE, but it does not erase the content of the line or any other line The documentation seems broken: ![doc](https://user-images.githubusercontent.com/18029016/75375772-0f83ec80-58cf-11ea-9f96-c6f853ecf0ba.png) # Issue Details * What did I do?  ## Output of YcmDebugInfo and :scriptnames   ## Output of vim --version  ## OS version, distribution, etc.  ## vimrc:","Can you try with no plugins enabled, except for YCM? That would eliminate the possibility of conflict with another plugin.","(Edited) Moreover, the documentation seems broken: ![doc](https://user-images.githubusercontent.com/18029016/75375772-0f83ec80-58cf-11ea-9f96-c6f853ecf0ba.png) ## vimrc: "
WeblateOrg/weblate,https://github.com/WeblateOrg/weblate/issues/2369,WeblateOrg_weblate_issues_2369,"'NoneType' object has no attribute 'tab_slug'

After upgrading from 2.13 to 2.16, I get the following error:  FYI, my upgrade script is:  **Server configuration and status**",Did you somehow manually adjust user profiles? This case should be handled by model validation...,<bountysource-plugin> --- Want to back this issue? **[Post a bounty on it!](https://www.bountysource.com/issues/65441086-nonetype-object-has-no-attribute-tab_slug?utm_campaign=plugin&utm_content=tracker%2F253393&utm_medium=issues&utm_source=github)** We accept bounties via [Bountysource](https://www.bountysource.com/?utm_campaign=plugin&utm_content=tracker%2F253393&utm_medium=issues&utm_source=github). </bountysource-plugin>
WeblateOrg/weblate,https://github.com/WeblateOrg/weblate/issues/2768,WeblateOrg_weblate_issues_2768,"celery broken after update of weblate to 3.6.1

**Describe the bug** Celery seems to be broken after the update from weblate 3.3 to 3.6.1. We have used celery configuration from 3.6.1 examples directory with path changes only. **To Reproduce** Steps to reproduce the behavior: 1. Install openSUSE Leap 15.1 + weblate-3.6.1 and l10n_opensuse_org-installer from https://build.opensuse.org/project/repository_state/M17N:l10n.opensuse.org/openSUSE_Leap_15.1 2. See errors in /var/log/celery/weblate-celery.log **Expected behavior** No errors. **Screenshots** **Server configuration and status**   **Additional context** /var/log/celery/weblate-celery.log",Maybe it's just processing existing queue? You can see queues status on /api/metrics/ URL.,<bountysource-plugin> --- Want to back this issue? **[Post a bounty on it!](https://www.bountysource.com/issues/74521603-celery-broken-after-update-of-weblate-to-3-6-1?utm_campaign=plugin&utm_content=tracker%2F253393&utm_medium=issues&utm_source=github)** We accept bounties via [Bountysource](https://www.bountysource.com/?utm_campaign=plugin&utm_content=tracker%2F253393&utm_medium=issues&utm_source=github). </bountysource-plugin>
WeblateOrg/weblate,https://github.com/WeblateOrg/weblate/issues/3206,WeblateOrg_weblate_issues_3206,"Too strict requirements to allow in-distribution updates

If you take look on openSUSE packages in obs I have to now convert == to >= to allow version updates we deliver sometimes faster than the bot: (note the diff-match-patch is unrelated to workaround something in the translation-toolkit deps)  Even now the weblate 3.9.1 is unresolvable for openSUSE because new 2.6 Pillow caused some regressions: https://build.opensuse.org/package/show/M17N:l10n.opensuse.org/weblate And if you look on the release product if I would like to base the weblate there I would have to update quite few python packages. Would it be possible to have pinned deps by depandbot and alternatively a list of least possible versions next to it we could use instead? We run the testsuite so we would see if something borked with the older versions in depgraph...",Do you have some example of project that does this?,<bountysource-plugin> --- Want to back this issue? **[Post a bounty on it!](https://www.bountysource.com/issues/83735593-too-strict-requirements-to-allow-in-distribution-updates?utm_campaign=plugin&utm_content=tracker%2F253393&utm_medium=issues&utm_source=github)** We accept bounties via [Bountysource](https://www.bountysource.com/?utm_campaign=plugin&utm_content=tracker%2F253393&utm_medium=issues&utm_source=github). </bountysource-plugin>
WeblateOrg/weblate,https://github.com/WeblateOrg/weblate/issues/2118,WeblateOrg_weblate_issues_2118,"2.17 -> 3.0 docker upgrade fails with postgres index error

https://docs.weblate.org/en/weblate-3.0/admin/deployments.html#upgrading-docker-container tried to upgrade 2.17.1-1 -> 3.0.1-4   restarting database container does not help","Did you get some error on the weblate container? If so, posting it would be more useful than the failed SQL query...",<bountysource-plugin> --- Want to back this issue? **[Post a bounty on it!](https://www.bountysource.com/issues/60700626-2-17-3-0-docker-upgrade-fails-with-postgres-index-error?utm_campaign=plugin&utm_content=tracker%2F253393&utm_medium=issues&utm_source=github)** We accept bounties via [Bountysource](https://www.bountysource.com/?utm_campaign=plugin&utm_content=tracker%2F253393&utm_medium=issues&utm_source=github). </bountysource-plugin>
WeblateOrg/weblate,https://github.com/WeblateOrg/weblate/issues/2192,WeblateOrg_weblate_issues_2192,"rebase fails because *~ backup files present

### Steps to reproduce 1. touch po/blah.po~ 2. Manage -> Repository maintenance -> Rebase Repository details shows:  i think older weblate (2.17?) created backup files each time it edit files, and those now cause rebase to fail? here's exception logged during error: https://ptpb.pw/7MYy ## version weblate/weblate:3.0.1-6 docker image",Do you have some addons installed? I think msgmerge could lead to this. Weblate itself definitely does not create backup files. Repository maintenance should certainly cover this.,<bountysource-plugin> --- Want to back this issue? **[Post a bounty on it!](https://www.bountysource.com/issues/62510229-rebase-fails-because-backup-files-present?utm_campaign=plugin&utm_content=tracker%2F253393&utm_medium=issues&utm_source=github)** We accept bounties via [Bountysource](https://www.bountysource.com/?utm_campaign=plugin&utm_content=tracker%2F253393&utm_medium=issues&utm_source=github). </bountysource-plugin>
